Q200608	ÉPHREM [frèm'] (saint). Père de l'Eglise, né à Nisibis (Mésopotamie), m. en 379. Fête le 9 juillet.
Q454101	ÉPICHARIS [ka-riss], femme romaine qui entra dans une conspiration contre Néron et s'étrangla pour ne pas révéler ses complices, après avoir subi les tortures les plus cruelles.
Q312410	ÉPICHARME [kar-me], poète et philosophe pythagoricien, né à Cos, m. vers 450 av. J.-C.
Q183144	ÉPICTÈTE, philosophe stoïcien du ier siècle, né à Hiéropolis (Phrygie). Il fut à Rome l'esclave d'Epaphrodite, affranchi de Néron. On raconte que son maître brutal, lui tordait un jour la jambe dans un appareil de torture : « Tu vas la casser ! » dit tranquillement Epictète, qui, sa prédiction réalisée, se contenta d'ajouter : « Ne te l'avais-je pas dit ? » Ses Entretiens furent réunis par Arrien en un corps d'ouvrage, et le même philosophe en fit un résumé connu sous le nom de Manuel d'Epictète, résumé lumineux de la doctrine stoïcienne.
Q43216	ÉPICURE, philosophe grec, né probablement à Samos, élève à Athènes de Xénocrate. Il enseignait que le plaisir est le souverain bien de l'homme, et que tous nos efforts doivent tendre à l'obtenir ; mais, loin de le faire consister dans les jouissances grossières des sens, Epicure le plaçait dans la culture de l'esprit et la pratique de la vertu. C'est donc, dit Fénelon, par une fausse interprétation de sa doctrine que l'on a pris pour un débauché un homme d'une continence exemplaire. Quoi qu'il en soit, le mot épicurien n'en est pas moins resté dans notre langue le synonyme de voluptueux, et, quand on veut parler d'un homme adonné aux jouissances de la table ou des sens, on dit : c'est un épicurien, un disciple d'Epicure. Horace disait : Epicuri de grege porcum, « Pourceau du troupeau d'Epicure. » C'est la doctrine épicurienne qui fait le fond du De natura rerum de Lucrèce (341-270 av. J.-C.).
Q233576	ÉPIDAURE [dô-re], v. de l'ancienne Argolide (Grèce), sur la côte de la mer Egée. Son oracle d'Esculape était fréquenté par les malades de toute la Grèce.
Q1218984	Épidicus [kuss], comédie de Plaute, celle qu'il préférait, et dans laquelle il a mis toute sa verve. Epidicus est un esclave dévoué au fils de son maître, une sorte de Scapin.
Q780650	ÉPIGONES, nom donné aux fils des sept chefs qui périrent devant Thèbes.
Q107264254	Épigrammes de Catulle. Le poète y a répandu à pleines mains le sel attique, la grâce ingénue, la délicatesse du sentiment et le sarcasme amer.
Q16604285	Épigrammes de Martial, remarquables par la finesse et le mordant, où il y a, comme le dit l'auteur lui-même, du bon, du médiocre ou du mauvais.
Q319406	ÉPIMÉNIDE de Gnosse, philosophe crétois du viie siècle av. J.-C. Personnage moitié historique, moitié légendaire. Il était fils d'une nymphe et avait dormi cinquante-sept ans dans une caverne ; le sommeil et le réveil d'Epiménide sont devenus l'objet de fréquentes allusions, surtout en politique.
Q41054	ÉPIMÉTHÉE, frère de Prométhée ; il épousa Pandore et eut l'imprévoyance d'ouvrir la boîte fatale, d'où tous les maux s'envolèrent sur la terre. Il ne resta au fond que l'Espérance. (Myth.)
Q1093003	ÉPINAC [nak], ch.-l. de c. (Saône-et-Loire), arr. d'Autun, sur la Drée ; 4.100 h. Ch. de f. P.-L.-M. Houille.
Q173695	ÉPINAL, ch.-l. du dép. des Vosges, à 378 kil. S.-E. de Paris, sur la Moselle ; 28.000 h. (Spinaliens). Camp retranché. Imagerie. L'arrond. a 6 cant., 127 comm., 113.600 h.
Q264254	ÉPINAY [nè] (Louise-Florence d'), femme distinguée, bienfaitrice de J.-J. Rousseau. Elle a publié des mémoires intéressants (1726-1783).
Q2825288	ÉPINAY (Adrien d'), avocat et homme politique, né à l'île Maurice ; il décida l'Angleterre à donner à sa patrie le régime libéral qu'elle réclamait ; mort à Paris (1794-1839).
Q313922	ÉPIPHANE (saint). Père et docteur de l'Eglise grecque, né en Palestine (310-403). Fête le 12 mai.
Q655381	ÉPIPHANE (saint), évêque de Pavie (438-495). Fête le 21 janvier.
Q565751	ÉPIRE, contrée de l'ancienne Grèce, au S. de la Macédoine. C'est en Epire qu'était le célèbre oracle de Dodone. (Hab. Epirotes.)
Q107264273	Épithalame de Thétis et de Pélée, le chef-d'œuvre de Catulle ; poème plus parfait sous le rapport du style que sous celui de la composition.
Q1226213	Épîtres d'Horace, poésies où l'auteur donne, dans un style familier, des conseils sur des sujets de morale et des questions de goût ; il y règne un laisser-aller apparent qui est une perfection de plus dans l'art de bien dire. L'Art poétique est une des Epîtres.
Q265283	Épîtres de saint Paul. Ces épîtres canoniques, au nombre de quatorze, remarquables par la puissance du raisonnement et par l'esprit de charité, ont excité l'admiration de saint Augustin et de Bossuet.
Q107264301	Épîtres et Épigrammes de Clément Marot, poésies familières, les meilleures productions de l'auteur, où brillent la grâce, la naïveté et la finesse dans la plaisanterie, comme aussi la verve, la gaieté et l'élégance (xvie s.). Marot, qui n'emploie que le vieux vocabulaire français, a fait faire toutefois de notables progrès à la versification française.
Q42119064	Épîtres de Boileau, un des meilleurs ouvrages de ce poète, où la raillerie se montre plus enjouée que satirique ; la dernière, adressée à Racine, réunit toutes les qualités de son talent (1669-1677).
Q3730710	Épodes d'Horace, pièces de vers ïambiques, au nombre de dix-sept, composées, pour la plupart, dans la jeunesse du poète.
Q3589326	ÉPONINE, femme du Gaulois Sabinus, qui entreprit, avec Civilis, d'affranchir les Gaulois du joug des Romains. Ayant été vaincu, Sabinus se retira dans sa maison, l'incendia et répandit au dehors le bruit de sa mort. Retiré au fond d'un souterrain, il fit savoir à sa femme le secret de son existence. Cette épouse héroïque alla s'enfermer avec lui dans ce tombeau, où pendant neuf années elle sut, par sa tendresse et ses soins, l'indemniser de la perte du jour et de la privation de la liberté. Trahi enfin, Sabinus fut livré à Vespasien, qui l'envoya au supplice, malgré les larmes et le sublime dévouement d'Eponine. Cette femme, martyre de l'amour conjugal, ne voulut pas survivre à l'époux qu'elle n'avait pu sauver ; elle insulta l'empereur et fut exécutée (78).
Q42189502	Époques de la nature (les), un des plus beaux ouvrages de Buffon, servant de supplément à son Histoire naturelle. Il y décrit les révolutions du globe terrestre et émet des hypothèses hardies, dont quelques-unes ont été reprises par Cuvier, ou même vérifiées par la science contemporaine.
Q683954	ÉPORÉDORIX [riks], guerrier éduen, qui se signala pendant l'insurrection de 51 av. J.-C. contre les Romains.
Q3166244	ÉPRÉMÉNIL. V. Espréménil.
Q6456045	Épreuve villageoise (l'), opéra en deux actes, paroles de Desforges, musique de Grétry (1784). Musique gracieuse, délicate.
Q993164	EPSOM [èp-som'], ville d'Angleterre (comté de Surrey), renommée pour ses eaux minérales et pour ses courses ; 8.500 h. C'est là que, depuis 1779, une célèbre course de chevaux (le Derby) a lieu le mercredi avant la Pentecôte.
Q990106	EPTE, riv. de France, affl. de la Seine (r. dr.) ; elle arrose Gisors et Saint-Clair ; 100 kil.
Q736	ÉQUATEUR [kou-a] (République de l'), Etat de l'Amérique du Sud ; capit. Quito ; 307.300 kil. c. ; 1.272.000 h. L'Equateur forme un Etat indépendant depuis le partage (en 1830) de la République de Colombie en trois Etats distincts : Nouvelle-Grenade ou république de Colombie, Venezuela et Equateur. Cacao, métaux précieux, café, caoutchouc, peaux, ivoire végétal, chapeaux de paille, quinquina.
Q381053	ÉQUES, ancien peuple d'Italie, dans le Latium, sur l'Anio. Ils furent vaincus par Camille et soumis au cours des guerres samnites.
Q5413483	Équilibre européen, surnom donné au système politique qui prétend assurer le maintien de la paix par le balancement des forces des grands Etats de l'Europe.
Q708709	ÉRARD [rar] (Sébastien), facteur d'instruments de musique français, né à Strasbourg, fondateur d'une importante manufacture de pianos (1752-1831).
Q377781	ÉRASISTRATE, médecin grec (iiie s. av. J.-C.).
Q359878	ÉRASME ou ELME (saint), évêque de Formies, près de Gaète, en Italie, au ve siècle. Les Lombards ariens le firent périr dans d'affreux tourments. Fête le 2 juin.
Q43499	ÉRASME (Didier), savant hollandais, littérateur et philosophe, né à Rotterdam, auteur de Colloques célèbres et de l'Eloge de la folie. Il est le plus grand des humanistes de la Renaissance. Son style et son esprit l'ont fait surnommer le Voltaire latin. Il mourut à Bâle où il s'était fixé pour faire imprimer ses œuvres (1467-1536).
Q105684225	Érasme (portrait d'), tableau de Holbein, au Louvre ; tête vivante, finesse d'exécution merveilleuse.
Q104413	ÉRATO, Muse qui présidait à l'élégie. On la représente avec une lyre.
Q43182	ÉRATOSTHÈNE, philosophe célèbre de l'école d'Alexandrie, né à Cyrène en 276 av. J.-C. Il se laissa mourir de faim à l'âge de quatre-vingts ans.
Q560467	ERCHINOALD ou ERKINOALD, maire du palais de Neustrie en 640, sous Clovis II, et d'Austrasie en 656.
Q357620	ERCILLA Y ZUNIGA (don Alonzo de), poète et guerrier espagnol, auteur de l'Araucana, né à Madrid (1533-1596).
Q1348668	ERCKMANN-CHATRIAN (Emile Erckmann et Alexandre Chatrian, dits), littérateurs français, nés, le premier à Phalsbourg (1822-1899), le second à Soldatenthal (Meurthe) [1826-1890]. Ils ont écrit en collaboration des romans historiques : l'Ami Fritz, Mme Thérèse, Histoire d'un Conscrit de 1813, etc., remarquables par un style d'une franchise et d'une bonhomie cordiales, et où revivent les mœurs de l'ancienne Alsace.
Q1349493	ERDRE, riv. de France, affl. de la Loire (r. dr.) à Nantes ; 105 kil.
Q4375074	Ère, époque fixe d'où l'on commence à compter les années. — Les ères principales sont les ères des Juifs, qui comptaient soit depuis leur sortie d'Egypte (1483 ou 1648 av. J.-C.), soit de la captivité de Babylone (597 av. J.-C.), soit de la construction du second temple (508 av. J.-C.) ; l'ère chrétienne, qui part de la naissance du Christ placée, d'ailleurs inexactement (v. Jésus), en l'an 754 de Rome ; l'ère des olympiades, chez les Grecs, 776 av. J.-C. ; l'ère de la fondation de Rome, 753 av. J.-C. ; l'ère de Nabonassar, chez les Babyloniens, 747 av. J.-C. ; l'hégire, ère des mahométans, 622 ; l'ère de la République française, 22 septembre 1792. On n'a compté que douze ans de cette ère ; après avoir dit l'an I, l'an II, l'an III, etc., l'an XII de la République, on a dit 1804, époque de la création de l'Empire.
Q131122	ÉRÈBE, nom donné à la région ténébreuse qui s'étend sous la terre au-dessus de l'Enfer (Myth.).
Q242741	Erechtéion, temple élevé sur l'Acropole d'Athènes à Erechthée.
Q301219	ÉRECHTHÉE [rèk], roi légendaire d'Athènes, fils de Pandion, et père de Cécrops (Myth.).
Q899184	ÉRÉSICHTON [zik-ton], fils d'un roi de Thessalie, qui, affligé d'une faim insatiable par Cérès, qu'il avait offensée, se dévora lui-même (Myth.).
Q320367	ÉRÉTRIE, ville d'Eubée, auj. Palœa-Castro. Elle fut détruite par les Perses pendant la première guerre médique (490 av. J.-C.).
Q1729	ERFURT [ér-fourt'], v. de Prusse (Saxe), sur la Géra ; 85,200 h. Napoléon y eut en 1808 avec le tsar une entrevue à laquelle assistèrent un grand nombre de souverains de l'Europe, et qui fut suivie d'un traité avantageux pour la France.
Q435290	ÉRICSSON (Jean), ingénieur suédois, né à Langbanshyttan (1803-1889).
Q1135146	ÉRIDAN, nom ancien du Pô.
Q5492	ÉRIÉ, lac de l'Amérique du Nord, au S.-E. du Canada ; 25.000 kil. car.
Q184500	ÉRIGÈNE (Jean Scot), philosophe et théologien, né en Ecosse ou en Irlande vers 833. Il se signala par la hardiesse de ses opinions. Charles le Chauve l'appela auprès de lui ; m. en 880.
Q52945	ÉRIK, nom de quatorze rois de Suède et de neuf rois de Danemark. Le plus célèbre, Eric XIV, fils de Gustave Wasa, régna de 1560 à 1577.
Q172345	ÉRIK le Rouge, chef norvégien qui découvrit le Groenland au xe siècle et envoya des expéditions sur la côte de l'Amérique du Nord.
Q22890	ÉRIN, ancien nom de l'Irlande.
Q180262	ÉRINNYES [nî] ou EUMÉNIDES, déesses que les Romains appelaient Furies. Filles de la Terre, elles vivaient dans le Tartare, ayant pour mission de punir les crimes des humains. On les représentait avec les cheveux entrelacés de serpents, tenant d'une main une torche ardente et de l'autre un poignard. Elles s'appelaient Tisiphone, Alecto, Mégère (Myth.).
Q6530209	Erinnyes (les), drame antique en vers et en deux parties, par Leconte de Lisle, avec intermèdes musicaux de Massenet (1873).
Q1125040	ÉRIPHYLE, femme du devin Amphiaraüs. Elle trahit, pour un collier que lui donna Polynice, son époux, qui se cachait pour ne pas se rendre à la guerre de Thèbes. Tuée par son fils Alcméon.
Q1953	ÉRIVAN, v. de la Russie d'Asie, l'une des capit. de l'anc. Arménie, auj. chef-lieu du gouv. d'Erivan, sur la Zanga, affl. de l'Aras ; 15.000 h.
Q3126	ERLANGEN, v. de Bavière (Franconie), sur la Regnitz ; 23.000 h. Célèbre université protestante.
Q921887	ERLON (Drouet d'). V. Drouet.
Q391953	ERMENONVILLE, comm. de l'Oise, arr. de Senlis ; 500 h. (Ermenonvillois.) Séjour de J.-J. Rousseau.
Q1431347	ERMITAGE, coteau de la Drôme, sur la r. g. du Rhône, qui fournit des vins très estimés.
Q132783	Ermitage (palais et musée de l'), construit par ordre de Catherine II à Saint-Pétersbourg ; le musée est une des plus belles galeries de peinture de l'Europe.
Q211279	Ernani, opéra en quatre actes de Verdi, paroles de Piave, sur le sujet du drame de Victor Hugo, Hernani (1844).
Q122766	ERNE, fleuve d'Irlande qui se jette dans l'Atlantique, après avoir traversé le lac Erne ; 100 kil.
Q838741	ERNÉE, ch.-l. de c. (Mayenne), arr. de Mayenne, sur l'Ernée, s.-affl. de la Loire ; 5.000 h. (Ernacéens). Ch. de f. O.
Q372190	ERNEST-AUGUSTE, premier électeur de Hanovre, se signala dans les guerres contre Louis XIV (1629-1698).
Q162302	ERNEST-AUGUSTE, roi de Hanovre, fils de George III, roi d'Angleterre, se fît remarquer en combattant les armées françaises de la Révolution et de l'Empire (1771-1851).
Q72076	ERNESTI (Jean-Auguste), philologue et théologien allemand (1707-1781).
Q528748	ERNST (Henri), compositeur et violoniste allemand, né à Brünn (1814-1865).
Q121973	ÉROS [ross], nom grec du dieu de l'Amour.
Q244944	ÉROSTRATE, Ephésien obscur qui, voulant, à l'exemple des conquérants, se rendre immortel par une destruction mémorable, incendia le temple de Diane à Ephèse, une des sept merveilles du monde, la nuit même où naquit Alexandre (356 av. J.-C.). Les Ephésiens, indignés, rendirent un décret qui défendait, sous peine de mort, de prononcer le nom d'Erostrate : c'était le meilleur moyen de lui assurer l'immortalité. Depuis, ce nom est passé dans toutes les langues pour caractériser ceux qui commettent un acte insensé dans le but de se rendre célèbres.
Q549214	ERPEN [pèn'] (Thomas van), orientaliste hollandais (1584-1624).
Q65084	ERSCH [èrch'] (Jean-Samuel), bibliographe allemand, auteur d'une Encyclopédie (1766-1828).
Q4655901	ERSKINE (Ebenezer), théologien écossais, un des fondateurs de l'Eglise dissidente d'Ecosse (1680-1756).
Q332672	ERSKINE (Thomas, lord), homme d'Etat anglais, né à Edimbourg, un des plus grands orateurs de son temps (1750-1823).
Q22517	ERSTEIN [ér-sta-in'], anc. ch.-l. de c. (Bas-Rhin) ; cédé à l'Allemagne ; 4.800 h. Sur l'Ill.
Q431199	ERVY, ch.-l. de c. (Aube), arr. de Troyes, non loin de l'Armance ; 1.400 h.
Q68243	ERWIN DE STEINBACH [èr-vin'], architecte de la cathédrale de Strasbourg, né à Steinbach (Bade) ; m. en 1318.
Q1363703	ÉRYMANTHE, montagne d'Arcadie, repaire d'un sanglier fameux tué par Hercule (Myth.).
Q986	ÉRYTHRÉE, nom sous lequel on désigne l'ensemble des possessions acquises par l'Italie sur la mer Rouge. Massaouah en est la ville principale.
Q1363807	ÉRYTHRÉE (mer), nom donné par les anciens d'abord à la mer des Indes, puis à la mer Rouge.
Q192917	ÉRYX [riks'], ville de la Sicile ancienne, au pied de la montagne du même nom. Temple de Vénus.
Q122803	ERZÉROUM, v. de la Turquie d'Asie (Arménie), place forte, chef-lieu du vilayet de ce nom ; 39.000 h.
Q4198	ERZGEBIRGE [èrts-ghé-bir-ghé] ou monts métalliques, chaîne de montagnes qui sépare la Saxe de la Bohême. Longue de 140 kil., elle atteint 1.275 mètres en son point culminant, le Keilberg. Nombreux gisements miniers.
Q193912	ESARHADDON. V. Assar-Haddon.
Q220822	ÉSAÜ, fils d'Isaac et de Rébecca, frère aîné de Jacob, auquel il vendit son droit d'aînesse moyennant un plat de lentilles. On rappelle souvent le plat de lentilles d'Esaü pour caractériser un marché de dupe, conclu dans un moment de nécessité. La Bible fait d'Esaü le père des Edomites.
Q3207682	Escarbagnas (la comtesse d'), comédie-farce en un acte et en prose, par Molière (1671). Par plaisanterie, on donne quelquefois ce nom à une personne entichée de sa noblesse jusqu'au ridicule.
Q1002059	ESCARÈNE (L'), ch.-l. de c. (Alpes-Maritimes), arr. de Nice, sur le Paillon de l'Escarène ; 1.300 h.
Q37620	ESCAUT [ès-kô], fleuve de France, de Belgique et de Hollande, naît dans le départ. de l'Aisne. Il passe à Cambrai, Valenciennes, puis à Tournai, Gand et Anvers et se jette dans la mer du Nord ; 400 kil. Navigation très active.
Q2093037	ESCAYRAC DE LAUTURE [ès-kè-rak, lô] (Pierre-Henri-Stanislas d'), voyageur français, né à Paris. Il voyagea en Egypte et en Chine (1826-1868).
Q18821	ESCHENBACH [è-chèn-bak] (Wolfram d'), poète allemand, né à Eschenbach (Bavière), auteur de poésies épiques et amoureuses (1170-1220).
Q317089	ESCHINE [ès-chi-ne], célèbre orateur d'Athènes, rival de Démosthène. Il défendit à Athènes la politique de Philippe, qu'on accusa de l'avoir acheté à prix d'argent. Il dut s'exiler d'Athènes à la suite de l'affaire de la Couronne. Ses discours Contre Timarque, sur l'Ambassade et sur la Couronne, brillent par l'abondance, l'habileté d'argumentation, l'éclat du style (389-314 av. J.-C.).
Q61266	ESCHSCHOLTZ [èch-cholts] (Jean-Frédéric), voyageur et naturaliste russe (1793-1831).
Q40939	ESCHYLE [ès-chi-le], le père de la tragédie grecque, né à Eleusis. Ses principales œuvres : les Perses, Prométhée enchaîné et la trilogie de l'Orestie font de lui un des plus grands poètes qui aient jamais existé. Son imagination puissante anime la nature, la légende et l'homme. Par la profondeur du sentiment religieux et des vues philosophiques, il est un penseur au moins autant qu'un grand poète lyrique (425-556 av. J.-C.)
Q2550219	Esclarmonde, opéra en 4 actes et 8 tableaux, poème d'Alfred Blau et Louis de Gramont ; musique de Massenet (1889).
Q8463	Esclavage. Fruit de l'oppression du faible par le fort, l'esclavage remonte aux premiers temps du genre humain. Il y avait des esclaves chez les Hébreux, chez les Grecs, chez les Romains, etc. Ceux-ci les recrutaient parmi les prisonniers de guerre et les peuples vaincus. Les marchands d'esclaves suivaient les armées, achetaient les captifs à l'encan, par grandes masses, et les envoyaient vendre au détail dans les marchés. Le nombre des esclaves excédait souvent le chiffre de la population libre, car l'enfant d'une esclave naissait esclave. A Rome, les esclaves formaient une classe avilie, réduite au rôle d'instrument d'utilité, de plaisir et de vanité. Au regard du droit civil, on peut dire qu'ils n'existaient pas ; ils héritaient pour leur maître, ils recevaient des donations pour leur maître, mais jamais pour eux, de sorte qu'ils n'étaient que des instruments, des intermédiaires et que tout ce qu'ils acquéraient appartenait à leur maître. Longtemps le maître eut droit de vie et de mort sur les esclaves ; aussi se révoltèrent-ils fréquemment, et les Romains eurent à soutenir contre eux, à plusieurs époques, des guerres redoutables. La guerre des esclaves, sous Spartacus, qui put en réunir 70.000 sous ses ordres, mit Rome à deux doigts de sa perte. Même lorsqu'ils étaient affranchis, les esclaves n'étaient pas, dans l'ancien droit, sur le même pied que les hommes d'origine ingénue, c'est-à-dire libres de naissance ; ils prenaient le nom de leur maître, qui devenait leur patron ; dans l'ordre politique, ils ne pouvaient aspirer à certaines dignités ni contracter mariage avec des ingénus. Sous l'empire, le droit de régénération ou assimilation avec les ingénus leur fut accordé de plus en plus fréquemment, et on vit certains d'entre eux s'élever aux hautes fonctions politiques. Ils exerçaient les professions commerciales et industrielles dédaignées par les ingénus. Quelques-uns, comme Narcisse, devinrent les conseillers des empereurs. D'autres brillèrent par leur génie ou leur talent : Térence, Esope, Phœdre, etc. Le célèbre poète Horace était fils d'un affranchi. — Les esclaves des Lacédémoniens, traités avec une dureté exceptionnelle, portaient le nom d'ilotes. De nos jours, l'esclavage est encore en pleine vigueur chez les nègres africains, malgré les efforts des Européens pour mettre un terme à la traite. En Asie et dans l'Amérique du Sud, il existe en maints endroits, et, en Russie, il n'a été transformé en servage que sous le règne de Nicolas Ier. Il a été aboli en 1833 dans l'Inde anglaise ; en 1848 dans les colonies françaises ; aux Etats-Unis en 1865 à la suite de la guerre de Sécession ; au Brésil en 1888.
Q11475544	Esclaves (guerre des), nom donné à trois guerres qu'eurent à soutenir les Romains contre leurs esclaves révoltés. La première éclata en Sicile (135 av. J.-C.) et dura deux ans. La seconde eut lieu de 105 à 102, également en Sicile ; la troisième, qui eut pour chef Spartacus et pour théâtre l'Italie, dura de 73 à 71 av. J.-C.
Q107264348	Esclaves (les), poème dramatique en cinq actes, par Edgar Quinet ; Spartacus en est le héros (1853).
Q5539	ESCLAVES (lac des), lac très poissonneux du Canada. Il se déverse par le fleuve Mackenzie, qui, durant une partie de son cours, porte le nom de rivière des Esclaves.
Q1360692	ESCLAVES (Côte des), partie de la côte d'Afrique comprise entre le Bénin et la côte d'Or, le long du Dahomey et du Yoruba. Elle est partagée aujourd'hui entre la colonie allemande du Togoland, le Dahomey et le Lagos anglais.
Q681964	ESCLAVONIE ou SLAVONIE. V. Croatie.
Q129402	ESCOBAR Y MENDOZA (Antonio), jésuite espagnol, né à Valladolid, fameux casuiste. Il défendit cette maxime que la pureté d'intention justifie les actions blâmées par les lois et la morale. Pascal l'a rendu immortel en attaquant avec vivacité sa doctrine dans les Provinciales (1589-1669).
Q5719017	ESCOÏQUIZ [ès-ko-i-ku-iz'] (don Juan), homme politique espagnol, précepteur de Ferdinand VII (1762-1820).
Q83223	ESCULAPE [ès-ku] ou ASCLEPIOS [oss], dieu de la médecine, fils d'Apollon. Non content de guérir les malades, dit la Fable, il ressuscitait même les morts. Jupiter, irrité, le foudroya à la prière de Pluton, dieu des Enfers, dont l'empire courait risque de devenir désert. Le coq, emblème de la vigilance, et le serpent, emblème de la prudence, étaient consacrés à Esculape. Dans le langage ordinaire, un disciple d'Esculape signifie un médecin ; un Esculape, un médecin habile ; ce n'est pas un Esculape, ce n'est pas un bon médecin. En poésie, en parlant des arrêts de la médecine, on dit : oracle d'Epidaure, parce qu'Esculape avait un temple dans cette ville.
Q28471	ESCURIAL [ès-ku], bourg d'Espagne, à 10 kil. de Madrid, près duquel s'élèvent le palais et le monastère bâtis (1562-1584) par Philippe II, en accomplissement d'un vœu. Pendant la bataille de Saint-Quentin (1557), l'artillerie espagnole ayant détruit une église dédiée à saint Laurent, Philippe II fit vœu d'élever un monastère en l'honneur de ce saint. Il fit alors construire l'Escurial et lui donna la forme d'un gril, en souvenir du supplice de ce saint (1562-1584).
Q271924	ESCUROLLES [ès-ku], ch.-l. de c. (Allier), arr. de Gannat ; sur l'Andelot, affl. de l'Allier ; 950 h.
Q191787	ESDRAS [ès-drass], fameux docteur juif du ve siècle av. J.-C. Deux Livres d'Esdras figurent dans l'Ancien Testament.
Q2698377	ESMÉNARD [ès-mé-nar] (Joseph-Etienne), poète fr., né à Pélissanne [Bouches-du-Rhône] (1769-1811).
Q661491	Esméralda (la), personnage de Notre Dame de Paris, par Victor Hugo ; type gracieux et idéalisé de la bohémienne ravissante de beauté, de fraîcheur, de grâce sauvage, courant les rues et les places publiques, accompagnée de sa petite chèvre aux cornes dorées, Djali.
Q410082	ESON, père de Jason ; il fut rajeuni par la magicienne Médée. En littérature, on fait quelquefois allusion à ce rajeunissement magique. V. Médée.
