Q4687007	ÉACÉES [sé], fêtes que l'on célébrait dans l'île d'Egine, en l'honneur d'Eaque, fils de Jupiter.
Q403377	ÉACIDE, roi d'Epire, m. en 313 av. J.-C.
Q403358	ÉACIDES, nom donné aux descendants d'Eaque, tels que Pélée, Achille et Pyrrhus Néoptolème, etc.
Q206187	ÉAQUE, fils de Jupiter, roi d'Egine. Célèbre par sa justice, il devint, à sa mort, l'un des trois juges des enfers avec Minos et Rhadamante (Myth.).
Q6133283	EARLE [ir-le] (James), chirurgien oculiste anglais, né à Londres (1755-1817).
Q7789218	EARLE (Thomas), jurisconsulte et écrivain américain (1791-1849).
Q1065352	EASTLAKE [ist'-lè-ke] (Charles Lock), peintre anglais, né à Plymouth, auteur d'une Histoire de la peinture à l'huile (1793-1865).
Q326162	EASTWICK [ist'-ouik'] (Edward Backhouse), orientaliste et diplomate anglais (1814-1883).
Q609744	EAUX-BONNES [ô-bo-ne], comm. des Basses-Pyrénées, arr. d'Oloron, au confluent de la Soude et du Valentin, affluent du gave d'Ossau ; 780 h. Eaux thermales sulfurées sodiques et calciques.
Q3046747	EAUX-CHAUDES [ô-chô-de], village de la commune de Laruns (Basses-Pyrénées), au-dessus du gave d'Ossau ; 220 h. Eaux thermales sulfureuses.
Q689525	EAUZE [é-au-ze], ch.-l. de c. (Gers), arr. de Condom, au-dessus de la Gélise ; 4.000 h. (Elusates). Eaux-de-vie. Patrie de Rufin.
Q942414	EBERHARD [è-bè-rard'] (Jean-Auguste), philosophe allemand, qui défendit les doctrines de Leibniz (1739-1809).
Q62765	EBERS [é-bèrss] (Georges-Maurice), égyptologue et romancier allemand, né à Berlin (1837-1898).
Q1278564	EBERSBERG [e-bèrs'-bèrgh] ou EBELSBERG, village d'Austro-Hongrie (Haute-Autriche) ; 2.200 h. Victoire de Masséna sur les Autrichiens (1809).
Q873849	EBERSDORF [é-bèrs'] ou KAISER-EBERSDORF, v. d'Austro-Hongrie (Basse-Autriche), en face de l'île Lobau ; 3.500 h.
Q208171	ÉBIONITES, hérétiques du ier siècle, qui niaient la divinité de Jésus-Christ et soutenaient que les pauvres seuls seront sauvés.
Q1344385	ÉBLÉ (Jean-Baptiste), général français, né à Saint-Jean-de-Rorbach (Moselle). Il fut chargé de surveiller pendant la retraite de Russie les ponts de la Bérésina, et sauva un grand nombre de malheureux. Il mourut en Prusse des suites de la campagne (1758-1812).
Q10965	ÈBRE, fleuve d'Espagne. Il a sa source dans les monts Cantabres, arrose Logroño, Saragosse, Tortose, et se jette dans la Méditerranée ; 900 kil.
Q273297	ÉBREUIL, ch.-l. de c. (Allier), arr. de Gannat, sur la Sioule, s.-affl. de l'Allier ; 2.150 h.
Q458841	ÉBROÏN [bro-in], maire du palais de Neustrie en 657 à la mort d'Erkinoald, sous Clotaire III, Thierry III et Childéric II. Il fit mettre à mort son adversaire saint Léger, et battit les Austrasiens à Latofao (680). Il périt assassiné l'année suivante.
Q323500	ÉBURONS [ron], peuple de la Gaule, établi entre la Meuse et la Dyle (auj. prov. belge de Liège).
Q696193	ECBATANE (Ahmeta d'après la Bible), capit. de l'ancienne Médie ; aujourd'hui Hamadan (Perse).
Q3717885	Ecce homo, tableau du Corrège, à la National Gallery (Londres) ; — du Titien et de Van Dyck, musée du Belvédère (Vienne) ; — d'Annibal Carrache et du Guerchin, pinacothèque de Munich ; — du Guide, de Pierre Mignard (Louvre).
Q131072	Ecclésiaste (l'), ouvrage attribué à Salomon, et rangé par l'Eglise dans les livres canoniques. Il développe la fameuse maxime : « Vanité des vanités, tout est vanité. »
Q155980	Ecclésiastique (l'), un des livres sapientiaux de l'Ancien Testament. Le concile de Trente l'a déclaré canonique, contrairement à l'opinion des juifs.
Q127349	ECHEGARAY (José), savant, auteur dramatique et homme politique espagnol, né à Madrid en 1835.
Q538131	ÉCHELLES (Les), ch.-l. de c. (Savoie), arr. de Chambéry, sur le Guiers-Vif ; 850 h.
Q3577463	Échelles du Levant. Ce nom, qui vient du turc iskele (jetée), est donné aux ports marchands de la Méditerranée soumis à la domination turque, tels que Constantinople, Salonique, Beyrouth, Smyrne, Alep, Alexandrie, Tripoli, etc.
Q87736953	Échevins ou scabins. Sous les deux premières races, les échevins ne furent que des conseillers judiciaires, et ils disparurent sous la féodalité pour faire place aux baillis et prévôts. Dans les villes, ils se firent nommer par les bourgeois à la direction des affaires municipales et, sous la présidence d'un maire, ils formèrent le conseil des communes. Ils furent supprimés en 1789. — A Toulouse on les appelait capitouls, et à Bordeaux jurats.
Q185670	ECHIDNA [é-kid'-na], monstre fabuleux, moitié femme et moitié serpent, qui enfanta Cerbère, l'hydre de Lerne, la Chimère, le Sphinx, le Dragon, la Gorgone, le lion de Némée, etc.
Q3365517	Échiquier, nom donné, sous l'ancien régime, au parlement de Normandie.
Q2408803	Échiquier, juridiction anglaise qui règle notamment les affaires de finances.
Q207368	ECHO [ko], nymphe qui, ayant mécontenté Junon, fut changée en rocher, et condamnée à répéter les derniers mots de ceux qui l'interrogeaient.
Q273413	ECIJA, v. d'Espagne, prov. de Séville, près du Génil, affl. du Guadalquivir ; 25.500 h.
Q490155	ECKMÜHL [mul'], village de Bavière, sur la Grande Laber ; 250 h. Napoléon y vainquit les Autrichiens en 1809. Davout fut créé prince d'Eckmühl.
Q135225	ECKMÜHL [mul'] (Phare d'), phare, un des plus beaux du monde, situé à la pointe de Penmarch (Finistère), à 60 mètres au-dessus du niveau de la mer, et construit, en 1897, grâce à un don de la fille de Davout, prince d'Eckmühl, d'où son nom.
Q3068554	ECKSTEIN (Ferdinand, baron d'), érudit et publiciste français d'origine danoise (1790-1861).
Q1478200	Éclair (l'), drame lyrique en trois actes, paroles de Saint-Georges et Planard, musique d'Halévy ; partition élégante, dont le succès fut très grand (1835).
Q1880701	Éclipse (l'), journal satirique qui parut de 1868 à 1876 sous la direction d'André Gill.
Q2065987	ÉCLUSE (L') [en hollandais Sluis], petite ville de Hollande, prov. de Zélande ; 1.650 h. Non loin de là, les Anglais gagnèrent une bataille navale sur les Français en 1340, au début de la guerre de Cent Ans.
Q3043171	Écluse (Défilé de l') ou Pas de la Cluse, défilé creusé entre le Jura et les Alpes (Ain), et franchi par la route qui va de Lyon à Genève. Il est défendu par le fort de l'Ecluse, construit à 420 mètres d'altitude sur les escarpements du Grand Crédo (ou Crêt d'Eau).
Q11917970	ECNOME (auj. Monte Serrato ou di Licata), cap montagneux de la Sicile méridionale, où les Carthaginois furent vaincus sur mer par Régulus et Manlius Vulso (256 av. J.-C.).
Q273480	École militaire, monument élevé à Paris, à l'extrémité du Champ-de-Mars, en 1752, par l'architecte Gabriel et destiné d'abord à la création d'une école militaire de jeunes gentilshommes. Depuis 1793 ses bâtiments n'ont cessé d'être occupés par un quartier de cavalerie. Ils contiennent aujourd'hui, en outre, l'Ecole supérieure de guerre.
Q1423962	École des maris (l'), comédie en trois actes et en vers, de Molière. Sganarelle en est le principal personnage. V. Sganarelle (1661).
Q937443	École des femmes (l'), comédie en cinq actes et en vers, de Molière (1662) ; œuvre admirable, la première en date des grandes comédies de Molière. Il y montre que la vertu d'une femme ne saurait reposer uniquement sur son ignorance du mal. — Critique de l'Ecole des femmes, comédie en un acte et en prose, de Molière (1663).
Q107249368	École des mères (l'), comédie en cinq actes et en vers de La Chaussée (1745) ; une des meilleures pièces du genre dit « larmoyant ».
Q471118	École de la médisance (l'), [School for scandal], comédie de Sheridan, une des pièces les plus originales et les plus gaies du théâtre anglais (1766). Elle est dirigée contre ces mille bavardages de société qui dénaturent les faits, et de légères peccadilles font quelquefois des crimes monstrueux.
Q107249392	École des vieillards (l'), comédie de Casimir Delavigne, bien construite et agréablement écrite (1823).
Q186953	École d'Athènes (l') ou la Philosophie, chef-d'œuvre de Raphaël, au Vatican (Chambres) ; les grands philosophes et les grands écrivains grecs Socrate, Platon, Aristote, Zénon, Empédocle, Diogène, Nicomaque, etc., sont groupés sur les degrés et sous le péristyle d'un temple. Scène imposante, physionomies expressives ; belle architecture.
Q28775131	École des singes (l'), tableau de David Teniers (Madrid). La gent écolière y est saisie dans toute sa pétulance et sa mutinerie.
Q17319772	École du soir (l'), tableau de G. Dov (Amsterdam). On y admire l'attitude du pédagogue, la naïveté des visages d'enfants, le pittoresque de la composition, la perfection de l'effet de lumière.
Q27624120	École turque (Sortie de l'), célèbre aquarelle de Decamps représentant une volée d'écoliers qui prend la clef des champs en se bousculant (1842).
