Q43423	ÉSOPE, fabuliste grec, d'abord esclave, puis affranchi ; mis à mort par les Delphiens. Le recueil actuel des Fables d'Esope, rédigé en prose grecque avec beaucoup de sécheresse, est attribué au moine Planude (500 av. J.-C.). Une circonstance de sa vie a donné naissance à cette locution : Les langues d'Esope, qui a passé dans la conversation. Son maître Xanthus lui ayant donné l'ordre d'acheter au marché ce qu'il y aurait de meilleur et rien autre chose, Esope n'acheta que des langues, qu'il fit accommoder à toutes les sauces. Les convives ne tardèrent pas à s'en dégoûter ! « Hé ? qu'y a-t-il de meilleur que la langue ? répondit Esope ; c'est le lien de la vie civile, la clef des sciences, l'organe de la vérité et de la raison ; par elle, on bâtit les villes et on les police, on instruit, on persuade, on règne dans les assemblées ; on s'acquitte du premier de tous les devoirs, qui est de louer les dieux. — Eh bien, reprit Xanthus, qui prétendait l'embarrasser, achète-moi demain ce qu'il y a de pire. » Le lendemain, Esope ne fit encore servir que des langues, disant que la langue est la pire chose qui soit au monde : « C'est la mère de tous les débats, la nourrice de tous les procès, la source des divisions et des guerres ; si elle est l'organe de la vérité, c'est aussi celui de l'erreur et, qui pis est, de la calomnie. Par elle on détruit les villes ; si, d'un côté, elle loue les dieux, de l'autre elle est l'organe du blasphème et de l'impiété. » — Les langues d'Esope sont restées célèbres pour désigner ce qui, pouvant être envisagé sous deux aspects opposés, donne prise également à la louange ou à la critique.
Q29	ESPAGNE, Etat du sud-ouest de l'Europe, occupant la plus grande partie de la péninsule hispanique ; capit. Madrid. I. Géographie. L'Espagne est séparée de la France par les Pyrénées, de l'Afrique par le détroit de Gibraltar ; elle est baignée au N.-O. et au S.-O. par l'Atlantique ; à l'E. et au S.-E. par la Méditerranée. Sa frontière occidentale est limitée par le Portugal. L'Espagne a une superficie de 504.500 kil. carrés, y compris les Baléares, et une population de 18.620.000 h. (Espagnols). C'est un plateau granitique ou calcaire d'une hauteur moyenne de 700 m., sillonné par les monts Ibériques, les monts Cantabres et les sierras d'Estrella, Morena, Nevada, et qu'arrosent le Minho, le Douro, le Tage, le Guadiana, le Guadalquivir, le Segura, l'Ebre. La péninsule produit divers métaux, des vins renommés (alicante, malaga, xérès), du bois, des céréales, des fruits (oranges, citrons, etc.), de l'huile d'olive. L'Espagne est une monarchie constitutionnelle. Le pouvoir exécutif y appartient au roi, le pouvoir législatif à deux Chambres, le Sénat et le Congrès, dont la réunion forme les Cortès. Au point de vue administratif, elle se divise en 47 provinces (49 en comptant les Baléares et les Canaries). Les colonies espagnoles, jadis si vastes, ne comprennent plus aujourd'hui que les possessions de l'Afrique occidentale (Fernando-Po, Annobon, etc.). II. Histoire. Les plus anciens habitants connus de l'Espagne furent les Celtibériens, mélange de Celtes et d'Ibères. De bonne heure, les Phéniciens et les Grecs fondèrent des colonies sur les côtes ; puis, au ve siècle, Carthage y établit sa prépondérance. Elle en fut chassée par les Romains, et l'Espagne ne changea plus de maître jusqu'à l'invasion des Alains, des Suèves et des Vandales. Ces derniers s'établirent dans la région appelée de leur nom Andalousie (409). Vers la même époque, les Wisigoths fondèrent un puissant Etat, qui fut détruit par l'invasion des Arabes en 711 (bataille de Xérès). L'histoire de l'Espagne jusqu'au xve siècle se résume dès lors dans la lutte du califat de Cordoue contre les chrétiens cantonnés dans les Asturies. Ceux-ci avaient réussi peu à peu à former des royaumes d'Espagne. (Arragon, Castille, Léon, Navarre), et à contrebalancer l'influence musulmane. En 1492, Ferdinand et Isabelle, dont le mariage avait, dès 1469, réuni sous le même sceptre l'Aragon et la Castille, s'emparèrent de Grenade et chassèrent enfin les Maures de la péninsule. La ruine des Maures avait coïncidé avec la découverte de l'Amérique. La monarchie espagnole ainsi établie atteignit son apogée et sa plus grande extension coloniale sous Charles-Quint et Philippe II. A l'extinction de la maison d'Autriche (1700), les Bourbons montèrent sur le trône d'Espagne dans la personne de Philippe V ; ils en furent chassés par Napoléon Ier, qui y établit Joseph Bonaparte (1804) ; mais ils furent restaurés en 1814. Ferdinand VII, lors de la révolution de 1820, prêta serment à la constitution ; mais le duc d'Angoulême fit une expédition en Espagne et rétablit la monarchie absolue (1823). Dans l'intervalle, les colonies espagnoles de l'Amérique s'étaient rendues indépendantes. En 1833, Isabelle remplaça Ferdinand VII sur le trône et y demeura trente-trois ans, malgré les efforts de don Carlos, frère du roi défunt. La révolution de 1868 la renversa et le maréchal Serrano garda le pouvoir exécutif jusqu'à l'avènement d'Amédée Ier (1870). Celui-ci ayant abdiqué (1873), on proclama la République et une insurrection carliste éclata, qui fut écrasée au profit d'Alphonse XII. Le fils posthume de ce monarque, né en 1886, a été proclamé sous la régence de sa mère Christine le jour même de sa naissance, sous le nom d'Alphonse XIII. En 1898, la guerre contre les Etats-Unis a fait perdre à l'Espagne Cuba et les Philippines.
Q150701	ESPAGNE (Succession d'). V. Succession.
Q1944803	ESPAGNE (Jean-Louis-Brigitte d'), général français, né à Auch, tué à la bataille d'Essling (1769-1809).
Q297838	Espagnolet (l'), surnom de Ribera.
Q326699	ESPALION, ch.-l. d'arr. (Aveyron), sur le Lot ; 4.150 h. (Espalionais). Laines. L'arr. a 9 cant., 49 comm., 55.700 h.
Q434529	ESPARTERO [ès-pa] (Baldomero), duc de La Victoire, général et homme politique espagnol, régent de la reine Isabelle de 1841 à 1843 (1792-1879).
Q236575	ESPELETTE [ès-pe], ch.-l. de c. (Basses-Pyrénées), arr. de Bayonne, sur le Laxa, affl. de la Nive ; 1.300 h.
Q184457	ESPEN [ès-pèn] (Zeger-Bernard van), jurisconsulte belge, né à Louvain (1646-1728).
Q169186	ESPÉRANDIEU [ès-pé] (Jacques-Henri), architecte français, né à Nîmes. On lui doit à Marseille la construction de la Chapelle de Notre-Dame de la Garde et le superbe Palais de Longchamp (1829-1874).
Q3203310	ESPÉROU [ès-pé] (mont de l'), massif des monts du Gévaudan, où naît l'Hérault ; 1.227 m.
Q706789	ESPINASSE [ès-pi] (Charles), général français, né à Saissac. Il seconda Louis Napoléon au coup d'Etat du Deux-Décembre et fut ministre de l'intérieur en 1858 ; tué à Magenta (1815-1859).
Q520504	ESPINEL [ès-pi-nèl] (Vicente), romancier et poète espagnol, auteur de Don Marcos de Obrégon, prototype de Gil Blas (1551-1634)
Q31394083	ESPINOUZE [és-pi] (monts de l'), massif des Cévennes méridionales dans les départ. de l'Hérault, du Tarn et de l'Aveyron. Point culminant 1.126 m.
Q43233	ESPIRITO-SANTO, prov. du Brésil ; 136.000 h. Ch.-l. Nossa-Senhora-da-Vittoria.
Q3166244	ESPRÉMÉNIL [nil'] (Jean-Jacques Duval d'), conseiller au parlement de Paris, né à Pondichéry. Député de la noblesse à la Constituante, il fit aux idées de 1789 autant d'opposition qu'il en avait fait au gouvernement de Louis XVI (1746-1794).
Q3020330	Esprit géométrique (De l'), fragment célèbre des Pensées de Pascal.
Q19955995	Esprit (De l'), par Helvétius (1758), ouvrage qui enseigne le matérialisme en métaphysique et l'égoïsme en morale, et qui, lors de son apparition, souleva de vives protestations.
Q51469657	Esprit des bêtes (l'), ouvrage très spirituel, de Toussenel ; c'est un sommaire de la chasse et de l'influence de cet art sur les progrès de l'humanité (1847).
Q514727	Esprit des lois (l'), ouvrage historique, politique et philosophique, l'œuvre capitale de Montesquieu (1748). C'est une revue des diverses législations et coutumes qui ont contribué à la prospérité des nations ou causé leur décadence, des circonstances qui ont présidé à la naissance des peuples et des principes moraux qui, se traduisant en révolutions, ont changé la face du monde. L'auteur découvre dans la nature des gouvernements les principes qui les animent, et de ces principes, combinés avec les besoins des peuples, il fait découler les lois qui les ont fait vivre ou qui les soutiennent encore. Sa prédilection est pour les monarchies tempérées, dont le gouvernement anglais était de son temps le type.
Q209077	ESPRONCEDA (José de), littérateur espagnol (1810-1842).
Q211233	ESQUILIN [ès-ku-i] (mont), une des sept collines de l'ancienne Rome.
Q131242	ESQUIMAUX [ès-ki-mô], populations des régions polaires qui habitent le Groenland et la région comprise entre la baie d'Hudson et le détroit de Behring. Ils s'appellent eux-mêmes Innuit. Quelques ethnographes regardent aussi comme Esquimaux les Tchouktches de la Sibérie.
Q517981	ESQUIROL [ès-ku-i] (Jean-Etienne-Dominique), médecin aliéniste français, né à Toulouse (1772-1840).
Q2839811	ESQUIROS [ès-ku-i-ross] (Henri-Alphonse), littérateur et homme politique français, né à Paris (1814-1876).
Q55596793	Esquisse des progrès de l'esprit humain, ouvrage de Condorcet, fondé sur la perfectibilité de l'homme (1795).
Q624852	Essais [è-sè] de Montaigne (1580). « Ceci est un livre de bonne foi, » a dit Montaigne. C'est le résumé de ses lectures, un recueil de ses souvenirs et de ses observations, une sorte de panorama mouvant et capricieux des impressions personnelles d'un esprit qui étudie et se scrute sans cesse. Témoin et acteur à la fois, il contemple la scène où il tient le premier rôle. Le moi, chez Montaigne, représente l'homme en général, cet être ondoyant et divers. Montaigne se garde bien d'affirmer ou de nier. Que sais-je ? Voilà sa conclusion, mais il ne met en question ni Dieu ni la vertu. Sa langue est une mine inépuisable de tours heureux et d'expressions pittoresques.
Q3944819	Essais de morale et de politique, ouvrage remarquable du philosophe F. Bacon (1597).
Q482427	Essai sur la critique, poème rappelant l'Art poétique de Boileau, par Pope, publié en 1711.
Q3121862	Essai sur l'homme, série de belles épîtres philosophiques, par Pope (1733-1734).
Q5399391	Essais moraux, politiques et littéraires, par D. Hume, recueil de petits traités pleins d'idées neuves et d'aperçus intéressants (1742-1752).
Q18214696	Essai sur le goût, ouvrage de Montesquieu, publié en 1748. Ce sont des réflexions, souvent justes et fines, sur les causes du plaisir qu'excitent en nous les œuvres littéraires et artistiques.
Q3058683	Essai sur les mœurs et l'esprit des nations, œuvre historique et philosophique de Voltaire. Voltaire élimine de la conduite des événements tout élément providentiel. Il croit au progrès et montre à travers la variété des mœurs des nations et la diversité de leur développement, la marche civilisatrice de l'humanité, qui se libère peu à peu de la superstition et de l'erreur (1756).
Q107263862	Essai sur les éloges, ouvrage de Thomas, livre théorique et critique sur un genre d'éloquence où lui-même avait excellé (1773).
Q19096493	Essai sur les facultés intellectuelles, ouvrage judicieux du philosophe écossais Th. Reid (1785).
Q107264545	Essais sur les facultés actives, ouvrage important et utile du philosophe écossais Th. Reid (1789).
Q42189561	Essai sur l'indifférence en matière de religion, ouvrage célèbre de Lamennais, écrit dans un style éloquent, mais avec des idées trop exclusives (1817).
Q107264571	Essai sur la philosophie des sciences, ouvrage du physicien Ampère, où se trouve son fameux essai de classification (1834).
Q17008111	Essais de critique et d'histoire, études sur des écrivains et des hommes d'Etat célèbres, par Macaulay ; ces portraits littéraires sont cités comme les modèles, par la profondeur des vues qu'ils renferment, et la netteté précise du style (1850).
Q504931	ESSARTS [è-sar] (Les), ch.-l. de c. (Vendée), arr. de La Roche-sur-Yon, sur la Petite-Maine ; 3.400 h.
Q3387775	ESSARTS (Pierre des), prévôt de Paris en 1408, tour à tour favori et ennemi de Jean sans Peur (1360-1413).
Q2066	ESSEN [è-sèn], v. de la Prusse rhénane ; 182.000 h. Célèbre usine des canons Krupp.
Q189204	Esséniens [ni-in], sectaires juifs du temps des Macchabées, dont les doctrines offraient une grande analogie avec celles des premiers chrétiens.
Q589911	ESSEQUIBO [è-sè-ku-i-bo], fleuve de la Guyane anglaise ; 800 kil.
Q23240	ESSEX [è-sèks], comté maritime du S.-E. de l'Angleterre, arrosé par la Tamise ; 780.000 h. Ch.-l. Chelmsford.
Q110888	ESSEX, royaume saxon, fondé en 526 ; capit. Londres.
Q437917	ESSEX (Robert Devereux, comte d'), grand écuyer d'Angleterre, favori d'Elisabeth ; il conspira contre elle et fut exécuté (1567-1601). — Son fils, chambellan de Charles Ier, embrassa la cause des parlementaires lors de la Révolution (1591-1646).
Q80340	ESSLING [ès-lin'gh], village d'Autriche, près de Vienne, où les Français remportèrent les 21 et 22 mai 1809 une sanglante victoire ; le maréchal Lannes y fut mortellement blessé ; 430 h.
Q3786	ESSLINGEN [ès-lin'-ghèn], v. de Wurtemberg, sur la r. dr. du Neckar, affl. du Rhin ; 27.300 h.
Q534813	ESSONNE, riv. de France, qui se jette dans la Seine r. g., à Corbeil ; 90 kil.
Q18281400	ESSONNES, comm. de France (Seine-et-Oise), arr. de Corbeil ; sur l'Essonne ; 9.400 h. Papeteries importantes, moulins.
Q474487	ESSOYES [è-soi], ch.-l. de c. (Aube), arr. de Bar-sur-Seine ; 1.500 h.
Q135388	EST [èst'] (canal de l'), qui met en communication la Meuse et le Rhône par la Moselle et la Saône.
Q153963	EST-AFRICAIN ALLEMAND, autre nom de l'Afrique orientale allemande.
Q876185	EST-AFRICAIN ANGLAIS (Imperial British East Africa) que l'on désigne ordinairement sous le nom d'Ibea (initiales de l'appellation anglaise). V. Afrique-orientale anglaise.
Q669539	ESTAGEL [ès'-ta-jèl], comm. des Pyrénées-Orientales, arr. de Perpignan ; sur l'Agly ; 2.800 h. Patrie des deux Arago.
Q384378	ESTAING [ès-tin], ch.-l. de c. (Aveyron), arr. d'Espalion, sur le Lot ; 1.300 h.
Q694048	ESTAING (Henri, comte d'), amiral français, né en 1129. Il se distingua aux Indes et en Amérique contre les Anglais ; il fut décapité en 1794.
Q3027515	Estampes (cabinet des), riche collection de gravures et de dessins formée primitivement par les rois de France, actuellement à la Bibliothèque nationale.
Q15969061	ESTANCELIN (Louis), publiciste français, né à Eu (1777-1858).
Q837998	EST-ANGLIE, un des royaumes de l'ancienne heptarchie anglo-saxonne, fondé en 571.
Q677173	ESTE (maison d'), illustre famille princière d'Italie, qui gouverna longtemps Ferrare, Modène et Reggio.
Q107264613	Estelle, pastorale de Florian. C'est une aimable bergerie, un peu fade parfois, mais où l'on trouve à louer de jolis tableaux de mœurs et des descriptions sincères de la nature (1788).
Q1369923	ESTEREL [ès-te-rèl] (monts de l'), massif montagneux des Alpes de Provence (Var et Alpes-Maritimes) dont le point culminant, le Vinaigre, a 616 m. d'alt.
Q748936	ESTERNAY [ès-tèr-nè], ch.-l. de c. (Marne), arr. d'Epernay, sur le Grand Morin, affl. de la Marne ; 1.580 h.
Q732413	ESTHER [ès-tèr], nièce de Mardochée, épouse d'Assuérus. Elle obtint du grand roi la grâce des juifs persécutés par Aman (Bible).
Q746818	Esther, tragédie en trois actes et en vers de Jean Racine, représentée pour la première fois à Saint-Cyr en 1688, devant la cour, par les demoiselles de Saint-Cyr. Délicieux poème, dont Sainte-Beuve a dit : « C'est l'épanchement le plus pur, la plainte la plus enchanteresse de cette âme tendre (Racine), qui ne savait assister à la prise d'habit d'une novice sans se noyer dans les larmes. »
Q131068	Esther (le Livre d'), un des livres de l'Ancien Testament, écrit probablement au ve siècle av. J.-C.
Q720496	ESTHONIE, gouvernement de la Russie d'Europe, près du golfe de Finlande ; 414.000 h. (Esthoniens), de race finnoise. Ch.-l. Revel.
Q745520	ESTIENNE [èss-ti-è-ne], illustre famille d'imprimeurs-libraires et d'érudits français. Les plus célèbres de ses membres furent Robert qui perfectionna la typographie (1503-1559) et son fils Henri, helléniste et lexicographe de grande valeur, qui mourut à l'hôpital de Lyon après s'être ruiné dans l'intérêt de la science. On doit à ce dernier un remarquable Thesaurus linguæ grecæ, monument gigantesque d'érudition et de savoir, et un célèbre discours sur la Précellence du langage françois (1531-1598).
Q1087309	ESTISSAC [ès-ti-sak], ch.-l. de c. (Aube), arr. de Troyes, sur la Vanne ; 2.000 h. Ch. de f. E. Scieries.
Q2007428	ESTOILE [é-toi-le] (Pierre Taisan de l'), chroniqueur français, né à Paris, auteur de Mémoires-journaux d'une impeccable véracité et d'une modération de ton et d'idées remarquable pour l'époque troublée où il vécut. C'est la source la plus précieuse à consulter pour l'histoire des règnes de Henri III et Henri IV (1546-1611).
Q656131	ESTOUTEVILLE [ès-tou] (Guillaume d'), cardinal négociateur français, m. en 1483.
Q3109699	ESTRADES [ès] (Godefroy, comte d'), diplomate et maréchal de France, né à Agen ; un des négociateurs du traité de Nimègue (1607-1686).
Q48749289	ESTRÉES [ès'-tré] (famille d'), famille noble de France, dont la branche la plus célèbre est celle de Picardie : Jean, grand maître de l'artillerie (1486-1571). — Antoine, fils de Jean, grand maître de l'artillerie de 1597 à 1600. — Gabrielle, fille d'Antoine, favorite d'Henri IV (1573-1599). — François-Annibal, marquis de Cœuvres, maréchal de France (1573-1670). — Jean, fils du précédent, amiral de France, né à Paris. Il guerroya dans les Antilles, reprit Cayenne aux Hollandais, et bombarda Tripoli (1624-1707). — Victor-Marie, fils du précédent, maréchal de France et vice-amiral, né à Paris (1660-1737).
Q1096136	ESTRÉES-SAINT-DENIS [ès-tré-sin-de-ni], ch.-l. de c. (Oise) arr. de Compiègne ; 1.600 h.
Q738004	ESTRELLA (sierra d') [ès] (chaîne de l'Etoile), chaîne de montagnes du Portugal, dont le pic le plus haut, le Malhao de serra, atteint 1.993 m.
Q5777	ESTRÉMADURE ESPAGNOLE, ancienne province d'Espagne ; capit. Badajoz ; forme actuellement les deux prov. de Badajoz et de Cacérès.
Q742117	ESTRÉMADURE PORTUGAISE, province du Portugal ; capit. Lisbonne, comprenant les districts de Leira, Santarem et Lisbonne ; 1.232.600 h.
Q625157	ESTREMOZ [ès-tre-moz'], v. de Portugal (Alemtejo) ; 5.200 h. Victoire des Portugais sur les Espagnols en 1663.
Q1370854	ÉSUS ou HÉSUS [zuss], dieu de la guerre chez les Gaulois.
Q1640	ESZEK, v. de Hongrie (Esclavonie), sur la Drave ; 23.000 h.
Q274910	ÉTABLES, ch.-l. de c. (Côtes-du-Nord), arr. de Saint-Brieuc, sur la baie de Saint-Brieuc ; 2.200 h.
Q288752	Établissements de saint Louis, recueil d'ordonnances et règlements datant de Louis IX, compilation qui n'a jamais eu force de loi, mais qui exerça une grande influence sur les légistes (1272).
Q59724	ÉTAIN [tin], ch.-l. de c. (Meuse), arr. de Verdun, sur un affluent de la Meuse ; 2.900 h. Ch. de f. E.
Q205584	ÉTAMPES [tan-pe], ch.-l. d'arr. (Seine-et-Oise), ch. de f. Orl., près de la Juine ; 9.000 h. (Etampois). Grains. Patrie de Geoffroy Saint-Hilaire. L'arr. a 4 cant., 70 com., 43,000 h.
Q257557	ÉTAMPES (Anne de Pisseleu, duchesse d'), favorite de François Ier, née en 1508, m. après 1585.
Q273522	ÉTAPLES, ch.-l. de c. (Pas-de-Calais), arr. de Montreuil, sur la Canche ; 4.700 h. Ch. de f. N. Traité entre Charles VIII et Henri VII d'Angleterre en 1492.
Q107192416	État-major autrichien (l') devant le corps de Marceau, tableau de J.-P. Laurens ; une des œuvres magistrales du peintre (1877).
Q16147749	États provinciaux. On appelait de ce nom, sous l'ancien régime, les assemblées des trois ordres de certains gouvernements français, qui, sur la convocation du roi, se réunissaient à des époques périodiques, afin de régler l'administration intérieure de la province et voter les subsides demandés par les commissaires royaux, pour subvenir aux frais de l'administration. Les principaux pays d'états étaient le Languedoc, la Provence, le Béarn, la Bourgogne et la Bretagne. Par opposition aux pays d'états, on appelait pays d'élections ceux où la répartition de la taille était opérée par des fonctionnaires royaux appelés d'abord élus, et investis d'attributions à la fois administratives et judiciaires.
