https://www.wikidata.org/wiki/Q76607	HOFFMANN (Frédéric), médecin et chimiste allemand, fondateur de la théorie organiste, né à Halle (1660-1742).
https://www.wikidata.org/wiki/Q539301	HOFFMANN (François-Benoît), auteur dramatique et critique français, né à Nancy (1760-1828).
https://www.wikidata.org/wiki/Q150471	HOFFMANN (Guillaume-Amédée), romancier et musicien allemand, né à Kœnigsberg. Doué d'une imagination excentrique en même temps que d'une grande finesse d'observation, il écrivit les Contes fantastiques (1776-1822).
https://www.wikidata.org/wiki/Q27136	HOFHOUF ou HOUFOUF, v. de l'Arabie orientale (prov. de Bassorah) ; 25.000 h.
https://www.wikidata.org/wiki/Q171344	HOGARTH (William), célèbre peintre de mœurs anglais, créateur, de la caricature morale, né à Londres (1697-1764).
https://www.wikidata.org/wiki/Q26399	HOGGAR. V. Ahaggar.
https://www.wikidata.org/wiki/Q107100708	HOGUE (La) ou LA HOUGUE, rade au N.-E. du départ. de la Manche, près de laquelle Tourville, combattant sur l'ordre exprès du roi malgré l'infériorité de ses cadres (44 vaisseaux contre 100), perdit glorieusement un combat contre les flottes combinées de l'Angleterre et de la Hollande (1692). On la confond quelquefois à tort avec le cap de la Hague.
https://www.wikidata.org/wiki/Q524334	HOHENLINDEN [ho-èn-lin'-dèn], village de Bavière, à la source de l'Isen, affl. de l'Inn ; 350 h. Moreau y battit l'archiduc Jean d'Autriche le 3 décembre 1800.
https://www.wikidata.org/wiki/Q77166	HOHENLOHE [ho-èn-lo-é] (Charles, prince), statthalter d'Alsace-Lorraine, puis chancelier de l'empire allemand, né à Rotenbourg en 1819.
https://www.wikidata.org/wiki/Q999916	HOHENMAUTH [ho-èn], ville d'Austro-Hongrie (Bohême), sur la Lautrehna ; 7.800 h.
https://www.wikidata.org/wiki/Q130875	HOHENSTAUFEN [ho-èn-sta-ou-fèn], illustre famille impériale d'Allemagne, originaire du Wurtemberg, dont les membres ont occupé le trône de 1138 à 1250.
https://www.wikidata.org/wiki/Q157013	HOHENZOLLERN [ho-èn-zol-lèrn'], principauté allemande, sur le Danube, berceau de la dynastie régnante ; ch.-l. Sigmaringen ; cédée à la Prusse en 1849. Elle forme aujourd'hui un district de la Prusse ; 66.700 h.
https://www.wikidata.org/wiki/Q313369	HOJEDA (Alonzo de), navigateur et conquistador espagnol, né à Cuença (1470-1515).
https://www.wikidata.org/wiki/Q5586	HOKOUSAÏ, dessinateur et graveur japonais. Il a excellé dans tous les genres et son œuvre est pleine de vie et d'humour (1760-1849).
https://www.wikidata.org/wiki/Q7104	HOLBACH [bak] (Paul-Henri, baron d'), philosophe matérialiste et athée, né à Hildesheim (1723-1789).
https://www.wikidata.org/wiki/Q48319	HOLBEIN [ba-in'] (Hans), peintre, né à Augsbourg en 1497. Il passa presque toute sa vie en Angleterre, où il mourut en 1543 ; portraitiste de grande valeur, auteur de la fameuse Danse macabre peinte à fresque sur les murs d'un des cimetières de Bâle, d'une vérité et d'un réalisme saisissants.
https://www.wikidata.org/wiki/Q216692	HOLBERG [bèrgh] (baron Louis de), auteur dramatique et poète danois, né à Bergen, surnommé le Plaute du Danemark (1684-1754).
https://www.wikidata.org/wiki/Q3289825	HOLLAND (Henri Fox, lord), homme d'Etat anglais, père du célèbre orateur Fox (1705-1774).
https://www.wikidata.org/wiki/Q102911	HOLLANDE ou NEDERLAND. V. Pays-Bas.
https://www.wikidata.org/wiki/Q3099753	Hollande (Gazette de), journaux et libelles que les réfugiés protestants imprimaient en Hollande contre Louis XIV.
https://www.wikidata.org/wiki/Q694	HOLLANDE-MÉRIDIONALE, prov. du royaume des Pays-Bas ; 1.240.500 h. Ch.-l. La Haye.
https://www.wikidata.org/wiki/Q701	HOLLANDE-SEPTENTRIONALE, prov. du royaume des Pays-Bas ; 1.038.500 h. Ch.-l. Haarlem.
https://www.wikidata.org/wiki/Q319829	HOLMES (Oliver-Wendell), médecin et littérateur américain, né à Cambridge (Massachusetts) [1809-1894].
https://www.wikidata.org/wiki/Q464636	HOLMÈS [mèss] (Augusta), compositeur français, né à Paris de parents irlandais, auteur de symphonies et de mélodies, etc., d'une inspiration chaude et colorée, et d'un opéra, la Montagne noire (1847-1903).
https://www.wikidata.org/wiki/Q625748	HOLOPHERNE, général de Nabuchodonosor, tué durant son sommeil par Judith, aux portes de Béthulie (Bible).
https://www.wikidata.org/wiki/Q704288	HOLSTEIN [sta-in'] (duché de), ancien Etat de la Confédération germanique, annexé en 1864 à la Prusse, en même temps que le Slesvig ; 600.000 h. (Holsteinois). Capit. Glukstad.
https://www.wikidata.org/wiki/Q257446	HOLYHEAD [hèd], v. et port très actif d'Angleterre (Anglesey) ; 9.000 h.
https://www.wikidata.org/wiki/Q505950	Holyrood, palais d'Edimbourg, résidence de Marie Stuart, de Charles X, etc.
https://www.wikidata.org/wiki/Q3050619	HOLYWELL [ouèl], v. d'Angleterre (Flint), près de l'embouchure du Dee ; 10.000 h.
https://www.wikidata.org/wiki/Q17635296	Homais [mè] (Monsieur), type créé par Flaubert dans Madame Bovary. Homais, pharmacien et libre penseur, personnifie la sottise bourgeoise teintée de littérature et de science ; un imbécile compliqué d'un demi-savant.
https://www.wikidata.org/wiki/Q71619	HOMBERG [bèrgh] (Guillaume), chimiste français, né à Batavia (1652-1715).
https://www.wikidata.org/wiki/Q4165	HOMBOURG [bour], ancienne capit. du landgraviat de Hesse-Hombourg, annexé à la Prusse ; 10.000 h. Eaux thermales.
https://www.wikidata.org/wiki/Q107100796	Homélies de saint Basile, discours élégants, pleins d'onction évangélique (ive s.)
https://www.wikidata.org/wiki/Q1626113	Homélies ou Discours de saint Grégoire de Nazianze, sermons élégants (ive s.).
https://www.wikidata.org/wiki/Q107100861	Homélies et Discours de saint Grégoire de Nysse, sermons contre certaines doctrines hérétiques (ive s.).
https://www.wikidata.org/wiki/Q107100891	Homélies et Discours de saint Jean Chrysostome, écrits éloquents, le modèle du genre (ive s.).
https://www.wikidata.org/wiki/Q6691	HOMÈRE, célèbre poète grec, regardé comme l'auteur de l'Iliade et de l'Odyssée. Sept villes se disputaient l'honneur de lui avoir donné naissance. La tradition le représente vieux et aveugle, errant de ville en ville et récitant ses vers ; mais, depuis les discussions soulevées notamment par Vico et Wolf, on a été jusqu'à contester son existence et à affirmer que l'Iliade et l'Odyssée ne seraient que le résumé des chants les plus populaires des anciens aèdes, mis en ordre par les diascévastes du temps de Pisistrate.
https://www.wikidata.org/wiki/Q3202169	Homère (Apothéose d') ou Homère déifié, chef-d'œuvre d'Ingres (Louvre) ; composition savamment distribuée, d'un dessin irréprochable, d'un coloris harmonieux mais froid.
https://www.wikidata.org/wiki/Q7467819	HOME RULE (le), nom donné au régime d'autonomie que les Irlandais revendiquent pour leur pays. (Ce mot vient de home, chez soi, et rule, gouvernement.)
https://www.wikidata.org/wiki/Q3570695	HOMMAIRE DE HELL (Ignace-Xavier), géologue et voyageur français, né à Altkirch (1812-1848).
https://www.wikidata.org/wiki/Q842337	Hommes illustres (Vies des), par Plutarque. V. Vies.
https://www.wikidata.org/wiki/Q107100929	Homme (Leçons sur l'), par Carl Vogt ; résumé des leçons de l'éminent professeur de l'institut genevois en 1862-1864 sur la place de l'homme dans la création et dans l'histoire de la terre.
https://www.wikidata.org/wiki/Q865211	Homme qui rit (l'), par Victor Hugo (1869), œuvre étrange mais puissante, dont le fond est une antithèse entre la beauté morale et la difformité physique.
https://www.wikidata.org/wiki/Q3203608	Homme aux quarante écus (l'), conte de Voltaire, où le philosophe raille avec une ironie spirituelle et parfois amère les abus de l'ancien régime.
https://www.wikidata.org/wiki/Q77187	HOMPESCH [hom'-pèch] (Ferdinand de), dernier grand maître de l'ordre de Malte, né à Dusseldorf (1744-1805) ; m. en France.
https://www.wikidata.org/wiki/Q131301	HOMS, v. de la Turquie d'Asie (Syrie), près du Nahr-el-Asi ; 25.000 h.
https://www.wikidata.org/wiki/Q43684	HONAN, prov. de Chine, dans le bassin inférieur du Hoang-Ho ; 21.000.000 h. Ch.-l. Khaï-Foung-Fou.
https://www.wikidata.org/wiki/Q13989	HONDO. V. Nippon.
https://www.wikidata.org/wiki/Q391344	HONDSCHOOTE [ond'-sko-te], ch.-l. de c. (Nord), arr. de Dunkerque ; 3.400 h. Les Français y battirent les Anglais et les Autrichiens en 1793.
https://www.wikidata.org/wiki/Q783	HONDURAS [râss], république de l'Amérique centrale ; 544.000 h. Capit. Tegucigalpa. Pays montagneux, bien arrosé, produisant le cacao, le café, le coton, l'indigo, le tabac, l'acajou.
https://www.wikidata.org/wiki/Q795608	HONDURAS (golfe ou baie de), formé par la mer des Antilles au S. de la presqu'île du Yucatan.
https://www.wikidata.org/wiki/Q1643555	HONDURAS BRITANNIQUE, colonie anglaise à l'extrémité du Yucatan ; 37.500 h. Capit. Belize.
https://www.wikidata.org/wiki/Q231720	HONFLEUR, ch.-l. de c. (Calvados), arr. de Pont-l'Evêque ; 9.600 h. (Honfleurais ou Honfleurois). A l'embouchure de la Seine. Ch. de f. O.
https://www.wikidata.org/wiki/Q8646	HONG-KONG, ville et île de la baie de Canton ; aux Anglais ; 260.000 h. Grand commerce de transit.
https://www.wikidata.org/wiki/Q25395037	HONGRIE, région de l'empire austro-hongrois, entre le Danube et les Karpathes. C'est la plaine de la Theiss et de ses affluents, descendus de la montagneuse Transylvanie ; 19.254.600 h. Capit. Budapest. Jadis royaume indépendant, habité par les Hongrois ou Magyars, la Hongrie fut réunie à l'Autriche au commencement du xviie siècle, mais ne cessa de revendiquer son indépendance ; à la suite du soulèvement de 1848, elle a obtenu une large autonomie administrative. V. Autriche-Hongrie.
https://www.wikidata.org/wiki/Q107101003	Honneur et l'argent (l'), comédie en cinq actes, en vers, de Fr. Ponsard ; œuvre estimable, mais dont on a peut-être exagéré le mérite (1853).
https://www.wikidata.org/wiki/Q18094	HONOLULU, capit. des îles Hawaï, dans l'Océanie ; 20.000 h. Port.
https://www.wikidata.org/wiki/Q526245	HONORAT [ra] (saint), évêque d'Arles ; mort en 429. Fête le 16 janvier.
https://www.wikidata.org/wiki/Q159798	HONORIUS [uss], empereur d'Occident de 395 à 423, un des plus misérables souverains de la décadence.
https://www.wikidata.org/wiki/Q170502	HONORIUS Ier, pape de 625 à 638 ; — Honorius II, pape de 1124 à 1130 ; — Honorius III, pape de 1216 à 1227 ; — Honorius IV, pape de 1285 à 1287.
https://www.wikidata.org/wiki/Q426954	HONTHEIM [ha-im'] (Jean-Nicolas), théologien catholique allemand, né à Trèves (1701-1790).
https://www.wikidata.org/wiki/Q314548	HONTHORST (Gérard), peintre flamand distingué ; il excella dans les effets de nuit, né à Utrecht (1590-1656).
https://www.wikidata.org/wiki/Q332623	HOOD [houd'] (Samuel), amiral anglais ; il s'empara de Toulon en 1793 (1735-1816).
https://www.wikidata.org/wiki/Q46830	HOOKE [hou-ke] (Robert), physicien et mathématicien anglais (1635-1703).
https://www.wikidata.org/wiki/Q157501	HOOKER [hou'-kèr] (Joseph-Dalton), botaniste anglais, né à Halesworth en 1817 ; auteur d'une remarquable classification systématique des plantes.
https://www.wikidata.org/wiki/Q9938	HOORN, ville des Pays-Bas (Hollande-Septentrionale) sur une baie du Zuyderzée ; 11.000 h.
https://www.wikidata.org/wiki/Q377848	HOPE (Thomas-Charles), chimiste anglais, né à Edimbourg, auteur de la démonstration du maximum de densité de l'eau (1766-1844).
https://www.wikidata.org/wiki/Q6197	HORACE (Quintus Horatius Flaccus), célèbre poète latin (64-8 av. J.-C.), auteur d'Odes, d'Epodes, d'Epîtres, de Satires et de l'Art poétique, imité par Boileau. Caractère indépendant, sans ambition, Horace, qui fut d'ailleurs l'ami d'Auguste et le protégé de Mécène, faisait consister le bonheur dans l'usage modéré des biens de la vie. Ses poésies, d'une forme savante et soignée, sont des modèles de délicatesse et de bon goût.
https://www.wikidata.org/wiki/Q535799	HORACES (les trois), nom de trois frères romains qui, sous le règne de Tullus Hostilius, combattirent pour Rome contre les trois Curiaces, champions de la ville d'Albe, en présence des deux armées, pour décider lequel des deux peuples commanderait à l'autre. Au premier choc, deux Horaces tombèrent, et les trois Curiaces furent blessés. Le survivant des Horaces, craignant de succomber contre ses trois adversaires réunis, feignit de prendre la fuite afin de les diviser, persuadé qu'ils le suivraient plus ou moins vite, suivant la gravité de leurs blessures. Sa prévision se vérifia en effet. Revenant alors impétueusement sur ses pas, il immola successivement les trois Curiaces et assura ainsi le triomphe de sa patrie. En récompense, il fut absous par le peuple du meurtre de sa sœur Camille. (V. plus bas.) — En littérature, on fait allusion à ce combat héroïque, et surtout au stratagème qu'employa le troisième Horace pour vaincre ses ennemis.
https://www.wikidata.org/wiki/Q2574569	Horace, tragédie de Pierre Corneille, en cinq actes et en vers (1640). Le sujet de cette pièce est le combat si connu des Horaces et des Curiaces, dramatique épisode de l'antique vertu romaine, s'élevant par l'amour de la patrie au-dessus des plus tendres affections de la famille. C'est dans cette tragédie que se trouve la réponse sublime du vieil Horace à la femme qui vient lui annoncer que, de ses trois fils, deux sont morts et que le troisième a pris la fuite. L'héroïque vieillard s'abandonne à toute sa douleur, non de la mort de ses deux fils, mais de la fuite du troisième. C'est alors que cette femme lui dit : Que vouliez-vous qu'il fît contre trois ? Et le vieil Horace répond : Qu'il mourût Parole admirable qui n'a pas besoin de commentaire ; cependant, c'est presque toujours par plaisanterie qu'on y fait allusion. C'est ainsi qu'un homme d'esprit, entendant parler d'un personnage qui était mort malgré les soins de trois savants médecins, s'écria avec une gravité risible : Que vouliez-vous qu'il fît contre trois ? Dans cette tragédie se trouvent encore les imprécations de Camille, sœur des Horaces et fiancée à l'un des Curiaces. Camille apprend l'issue fatale du combat, et, à la vue de son frère, couvert de la dépouille sanglante de celui qui devait être son époux, elle exhale sa douleur en imprécations contre le vainqueur et contre Rome même. Horace, indigné des plaintes de sa sœur comme d'un reproche fait à son patriotisme, la perce de son épée.
https://www.wikidata.org/wiki/Q476458	Horaces (Serment des), tableau de Louis David, au Louvre (1785).
https://www.wikidata.org/wiki/Q1115859	HORATIUS [si-uss] Coclès (le Borgne), Romain qui, d'après la légende, défendit seul l'entrée du pont Sublicius contre l'armée de Porsenna ; il perdit un œil dans la bataille, d'où son surnom.
https://www.wikidata.org/wiki/Q269297	HÖRDE [heur-dé], v. d'Allemagne (Prusse), sur l'Emscher ; 25.000 h.
https://www.wikidata.org/wiki/Q79965	HORDE D'OR, nom du royaume le plus occidental fondé au moyen âge par les Mongols, et qui s'étendait sur la Sibérie méridionale et la partie sud de la Russie.
https://www.wikidata.org/wiki/Q1420926	HOREB [rèb], montagne d'Arabie. C'est là que Moïse reçut de Dieu, qui lui apparut au milieu d'un buisson ardent, la première révélation de sa mission (Bible).
https://www.wikidata.org/wiki/Q160931	HORMISDAS [dâss] (saint), pape de 514 à 523.
https://www.wikidata.org/wiki/Q4078	HORN (cap), à l'extrémité S. de la Terre-de-Feu, formé par une île aux sombres et stériles falaises.
https://www.wikidata.org/wiki/Q550657	HORN (Gustave), un des plus habiles généraux de Gustave-Adolphe (1592-1657).
https://www.wikidata.org/wiki/Q700105	HORNES (Philippe, comte de), gouverneur de la Gueldre sous Charles-Quint, décapité sous Philippe II par ordre du duc d'Albe, sous le motif de trahison (vers 1520-1568).
https://www.wikidata.org/wiki/Q84233114	HORNOY [noi], ch.-l. de c. (Somme), arr. d'Amiens ; 900 h. Ch. de f. N.
https://www.wikidata.org/wiki/Q2454407	HORNSEY, v. d'Angleterre (comté de Middlesex) ; 72.000 h. Voisine de Londres.
https://www.wikidata.org/wiki/Q680164	HORPS [or] (le), ch.-l. de c. (Mayenne), arr. de Mayenne ; 1.300 h.
https://www.wikidata.org/wiki/Q190235	HORSENS [sèn's'], v. du Danemark (Jutland), sur le Cattégat ; 22.300 h.
https://www.wikidata.org/wiki/Q229875	HORTENSE [tan-se] (la reine), fille de l'impératrice Joséphine et du comte de Beauharnais. Elle épousa Louis Bonaparte, roi de Hollande, et fut mère de Napoléon III (1783-1837).
https://www.wikidata.org/wiki/Q320902	HORTENSIUS [tin-si-uss] (Quintus), célèbre orateur romain, rival de Cicéron, puis son ami (114-50 av. J.-C.).
https://www.wikidata.org/wiki/Q84122	HORUS, dieu égyptien, représenté tantôt par un épervier, tantôt par un homme à tête d'épervier.
https://www.wikidata.org/wiki/Q638350	HORVATH (Michel), évêque et historien hongrois, né a Szentes (1809-1878).
https://www.wikidata.org/wiki/Q640968	Hôtel de ville de Paris, célèbre édifice, siège de la municipalité parisienne, situé sur la place du même nom ; commencé en 1533, achevé en 1623, restauré et agrandi sous Louis-Philippe, détruit par le feu en 1871 et reconstruit en 1878-1879, sous la direction de MM. Ballu et De Perthes. L'aspect général, élégant et somptueux, est celui de l'ancien édifice, développé en hauteur et en superficie.
https://www.wikidata.org/wiki/Q1294736	Hôtel-Dieu, le plus ancien hôpital de Paris, autrefois situé parvis Notre-Dame, fondé par saint Landry, huitième évêque de Paris. Incendié en 1772, il fut reconstruit sur le même emplacement. Un nouvel Hôtel-Dieu a été construit de 1868 à 1878, de l'autre côté de la cathédrale, en remplacement de l'ancien qui tombait en ruine.
https://www.wikidata.org/wiki/Q561737	HOTMAN (François), jurisconsulte français, né à Paris ; auteur du Franco-Gallia, où il essaye de réagir contre les progrès de l'absolutisme, imprudemment favorisé par les légistes (1524-1590).
https://www.wikidata.org/wiki/Q219252	HOTTENTOTS [tan-to], race de l'Afrique australe comprenant les Hottentots proprement dits, les Namaquas et les Koronas.
https://www.wikidata.org/wiki/Q1694883	HOTTINGER [tin'-ghèr] (Jean-Jacques), historien suisse, né à Zurich. Son ouvrage capital a pour titre : Zwingle et son époque (1783-1860).
https://www.wikidata.org/wiki/Q33412	HOUBLÎ, v. de l'Inde anglaise (Deccan) ; 60.000 h.
https://www.wikidata.org/wiki/Q1685098	HOUCHARD [char] (Jean-Nicolas), un des généraux de la Révolution, né à Forbach. Vainqueur à Hondschoote des Anglais ; guillotiné à Paris (1738-1793).
https://www.wikidata.org/wiki/Q380216	HOUDAIN [din], ch.-l. de c. (Pas-de-Calais), arr. de Béthune, sur la Lawe ; 1.800 h. Ch. de f. N.
https://www.wikidata.org/wiki/Q389485	HOUDAN, ch.-l. de c. (Seine-et-Oise), arr. de Mantes, au confluent de la Vesgre et de l'Obton ; 2.000 h. (Houdanais). Ch. de f. O. Volailles renommées.
https://www.wikidata.org/wiki/Q533324	HOUDETOT [to] (Elisabeth, comtesse d'), femme distinguée par son esprit, amie de Saint-Lambert et de Jean-Jacques Rousseau (1730-1813).
https://www.wikidata.org/wiki/Q318741	HOUDON (Jean-Antoine), statuaire français, né à Versailles. Il a exécuté les bustes d'un grand nombre d'hommes distingués, entre autres de Voltaire. Ses œuvres sont pleines de naturel et de vérité (1741-1828).
https://www.wikidata.org/wiki/Q776892	HOUEILLÈS [ll mll., èss], ch.-l. de c. (Lot-et-Garonne), arr. de Nérac ; 1.100 h.
https://www.wikidata.org/wiki/Q739687	HOUGLI, branche occidentale du Gange, arrose Chandernagor et Calcutta. 195 kilom.
https://www.wikidata.org/wiki/Q848132	HOULGATE, village de la comm. de Beuzeval, sur la Manche ; 600 h. Plage fréquentée.
https://www.wikidata.org/wiki/Q45761	HOU-NAN, prov. de la Chine méridionale ; 15 millions d'h. Ch.-l. Tchang-Cha.
https://www.wikidata.org/wiki/Q46862	HOU-PÉ, prov. de la Chine centrale ; 28.300.000 h. Ch.-l. Ou-Tchang.
https://www.wikidata.org/wiki/Q665238	HOUPLINES, comm. du Nord (arr. de Lille), sur la Lys ; 8.000 h. Filatures.
https://www.wikidata.org/wiki/Q705210	HOUSSAYE [sè] (Arsène), littérateur français, né à Bruyères, auteur aimable et spirituel du Quarante et unième fauteuil de l'Académie française, le Roi Voltaire, etc. (1815-1896). — Son fils Henri, historien, né à Paris en 1848, membre de l'Académie française, auteur de remarquables études historiques sur la fin du règne de Napoléon Ier.
https://www.wikidata.org/wiki/Q16555	HOUSTON, v. des Etats-Unis (Texas), sur le canal Buffalo ; 35.000 h.
https://www.wikidata.org/wiki/Q721588	HOVAS, une des races qui peuplent l'île de Madagascar. D'origine malaise, elle constituait, au moment de la conquête française, l'aristocratie de l'île.
https://www.wikidata.org/wiki/Q1517131	HOWARD [ouard'], nom d'une illustre famille d'Angleterre, qui a fourni des généraux, des amiraux, etc., et à laquelle appartenait la cinquième femme de Henri VIII, Catherine Howard, décapitée en 1542.
https://www.wikidata.org/wiki/Q360359	HOWE (Elias), mécanicien américain, inventeur d'une machine à coudre (1819-1867).
https://www.wikidata.org/wiki/Q205697	HOWRAH ou HAORA, v. de l'Inde, sur le delta du Gange, près Calcutta ; 158.000 h.
https://www.wikidata.org/wiki/Q2652473	HOZIER [zi-é] (Pierre de la Garde d'), généalogiste et juge d'armes, né à Marseille (1592-1660). — Son fils René, généalogiste, né à Paris (1640-1732). Ce nom est devenu une sorte de nom commun pour désigner ceux qui s'occupent de recherches généalogiques.
https://www.wikidata.org/wiki/Q611388	HUALLAGA, rivière de l'Amérique du Sud, affluent du Marañon ou haut Amazone (1.250 kil.).
https://www.wikidata.org/wiki/Q159834	HUBERT [bèr] (saint), évêque de Maëstricht et de Liège, patron des chasseurs. Il aurait vécu au viie siècle.
https://www.wikidata.org/wiki/Q517828	HUBERTSBOURG [bèrts-bour], pavillon de chasse, près de Leipzig. Là fut signé le traité qui mettait fin à la guerre de Sept Ans (1763).
https://www.wikidata.org/wiki/Q84999	HÜBNER [nèr] (Alexandre, baron de), diplomate et voyageur autrichien, né à Vienne, auteur d'une Promenade autour du monde (1811-1892).
https://www.wikidata.org/wiki/Q291281	HUC [huk] (Evariste-Regis), missionnaire français, né à Toulouse, explorateur de la Chine, de la Tartarie et du Thibet (1813-1860).
https://www.wikidata.org/wiki/Q1059171	HUCQUELIERS [ke-li-é], ch.-l. de c. (Pas-de-Calais), arr. de Montreuil-sur-Mer ; 700 h.
https://www.wikidata.org/wiki/Q201812	HUDDERSFIELD [dèrs-fild'], ville d'Angleterre (York), sur la Colne ; 95.000 h.
https://www.wikidata.org/wiki/Q179167	HUDSON [son'] (Henri), navigateur anglais, qui découvrit le détroit et la baie d'Hudson en 1610.
https://www.wikidata.org/wiki/Q3140	HUDSON, fleuve du N.-E. des Etats-Unis, qui arrose Albany et se jette dans l'Atlantique à New-York ; 500 kil., en pays à peu près désert.
https://www.wikidata.org/wiki/Q3040	HUDSON (baie ou mer d'), vaste golfe formé par l'Atlantique au N. de l'Amérique septentrionale ; il est pris par les glaces pendant sept mois de l'année.
https://www.wikidata.org/wiki/Q36167	HUÉ, v. de l'Indo-Chine française, capit. du royaume d'Annam ; 50.000 h. Communique par la rivière de Hué avec la mer. Prise par l'amiral Courbet en 1883.
https://www.wikidata.org/wiki/Q381308	HUELGOAT [gho-a], ch.-l. de c. (Finistère), arr. de Châteaulin ; 1.600 h. Plomb argentifère.
https://www.wikidata.org/wiki/Q12246	HUELVA, v. d'Espagne, ch.-l. de prov., sur l'Odiel ; 20.000 h. — La prov. de Huelva a 260.000 h.
https://www.wikidata.org/wiki/Q251560	HUERTA (Garcia de La). V. La Huerta.
https://www.wikidata.org/wiki/Q11967	HUESCA, v. d'Espagne, ch.-l. de prov. ; près de l'Isnela ; 15.000 h. — La prov. a 15.000 h.
https://www.wikidata.org/wiki/Q575709	HUESCAR, v. d'Espagne, prov. de Grenade, sur le Quardal ; 8.000 h. Sources minérales.
https://www.wikidata.org/wiki/Q568497	HUET (Pierre-Daniel), prélat et érudit français, évêque d'Avranches. Né à Caen (1630-1721).
https://www.wikidata.org/wiki/Q3084875	HUET (François), philosophe spiritualiste français, né à Villeau [Eure-et-Loir] (1814-1869).
https://www.wikidata.org/wiki/Q366078	HUGHES (David), physicien anglais, né à Londres. On lui doit l'invention du microphone, du télégraphe à clavier, etc. (1831-1900).
https://www.wikidata.org/wiki/Q2299673	HUGO (Sigisbert, comte), général français, né à Nancy (1774-1828).
