Q348961	LOUIS Ier, comte d'Anjou, second fils du roi de France Jean II. Institué héritier du trône de Naples par la reine Jeanne en 1380, il se fit couronner par le pape en 1382, mais il ne put chasser du trône son compétiteur Charles de Duras ; m. en 1384 ; — Louis II, comte d'Anjou, roi de Naples. Couronné par le pape en 1389, il ne régna qu'à des intervalles plus ou moins éloignés, par suite de ses démêlés avec son compétiteur Ladislas.
Q156175	LOUIS Ier, roi de Portugal, né en 1838, monté sur le trône en 1861, m. en 1889.
Q43974	LOUIS Ier, empereur d'Allemagne de 814 à 840, le même que Louis le Débonnaire, roi de France ; — Louis II, le Jeune, empereur d'Allemagne de 855 à 875, fils de Lothaire Ier ; — Louis III, l'Aveugle, empereur d'Allemagne de 900 à 905, petit-fils du précédent ; — Louis IV, le Bavarois, empereur d'Allemagne de 1314 à 1347.
Q43974	LOUIS Ier, roi de Germanie, le même que Louis le Débonnaire ; — Louis II, le Germanique, troisième fils du précédent, roi de Germanie de 817 à 876 ; — Louis III, le Saxon, roi de Germanie de 876 à 882, fils du précédent ; — Louis IV, l'Enfant, roi de Germanie en 899, le dernier des carolingiens d'Allemagne, m. en 911 ; — Louis V, roi de Germanie, le même que Louis IV, empereur d'Allemagne.
Q44361	LOUIS Ier, roi de Bavière de 1825 à 1848. Il abdiqua en faveur de son fils Maximilien II ; fit construire la glyptothèque de Munich ; m. en 1868 ; — Louis II, roi de Bavière, fils de Maximilien II, roi de Bavière de 1864 à 1886, mort noyé dans le lac de Starnberg.
Q43974	LOUIS Ier, le Débonnaire, fils de Charlemagne et de Hildegarde, né à Chasseneuil (Lot-et-Garonne), en 778, empereur d'Occident et roi des Francs de 814 à 840. Il réprima une révolte de son neveu Bernard, roi d'Italie (818), épousa d'abord Ermengarde, puis Judith de Bavière (819), et eut durant tout son règne à combattre les révoltes de ses fils Lothaire, Louis et Pépin.
Q182840	LOUIS II, le Bègue, fils de Charles le Chauve et d'Ermentrude, né à Compiègne en 846, roi de France de 877 à 879. Il épousa Ansgarde, sœur d'Eudes, comte de Bourgogne, puis Adélaïde. Il mourut au moment où il se mettait en route pour réprimer une révolte de Bernard, duc de Septimanie.
Q193112	LOUIS III, fils de Louis II et d'Ansgarde, né vers 863 roi de France de 879 à 882. Il dut abandonner une partie de la Lorraine à son compétiteur Louis de Germanie, partagea ses Etats avec son frère Carloman, à qui il donna l'Aquitaine et la Bourgogne, et vainquit les Normands à Saucourt-en-Vimeu (Somme).
Q193658	LOUIS IV, d'Outremer, fils de Charles III, le Simple et d'Odgiwe, né en 921, roi de France de 936 à 954. Arrivé au trône grâce à l'appui de Hugues, comte de Paris, il lutta contre les Hongrois et les Normands. Ces derniers cependant le firent prisonnier et gardèrent quelque temps Laon et Nîmes. Il recouvra la liberté grâce à l'empereur Othon le Grand dont il avait épousé la sœur Gerberge.
Q205289	LOUIS V, le Fainéant, fils de Lothaire et d'Emma, né en 967, roi de France de 986 à 987. Il mourut d'un accident de chasse, et avec lui finit la dynastie carolingienne.
Q165883	LOUIS VI, le Gros, l'Éveillé ou le Batailleur, fils de Philippe Ier et de Berthe de Hollande, né en 1081, associé au trône de 1098 à 1108, roi de France de 1108 à 1137. Avec ce monarque, la royauté entreprit contre les grands vassaux, avec l'appui du clergé et des villes, une lutte sans merci, qui devait aboutir à la centralisation administrative et monarchique. Il réussit, au moyen d'un grand nombre de petites expéditions, à rétablir l'ordre dans le domaine royal. Il combattit Henri Ier roi d'Angleterre, qui possédait la Normandie, mais fut battu à Brenneville en 1119. L'empereur d'Allemagne Henri l'ayant menacé la France d'une invasion, Louis VI prit à Saint-Denis l'oriflamme, bannière du saint qui protégeait la France, et les milices adoptèrent comme signe de ralliement le cri de Montjoie Saint-Denis. Louis VI avait épousé Alix de Savoie. Sous son règne commença l'émancipation de la bourgeoisie, émancipation dont Louis le Gros ne prit point l'initiative, mais dont il fit profiter la royauté. V. Communes.
Q134259	LOUIS VII, le Jeune, fils de Louis VI et d'Alix de Savoie, né en 1119, roi de France de 1137 à 1180. Il épousa Eléonore d'Aquitaine et chercha inutilement à prendre le comté de Toulouse. Il se vengea de Thibaut, comte de Champagne, en faisant brûler dans l'église de Vitry 1.300 personnes. L'interdit prononcé à cette occasion par le saint-siège ayant été levé par Célestin II, Louis VII, en manière d'expiation, entreprit la seconde croisade. A son retour, il divorça d'avec Eléonore (1152), qui épousa Henri II Plantagenêt et apporta en dot au roi d'Angleterre les plus riches provinces du sud-ouest de la France. Telle est la cause première des luttes qui aboutirent à la guerre de Cent ans. A l'intérieur, Louis VII fut puissamment secondé par son ministre Suger. En 1154, Louis VII avait épousé en secondes noces, Constance de Castille.
Q165284	LOUIS VIII, le Lion, fils de Philippe Auguste et d'Isabelle de Hainaut, né en 1187, roi de France de 1223 à 1226. Appelé en Angleterre par les barons soulevés contre Jean Sans-Terre, il fut couronné à Londres (1216), mais, vaincu à Lincoln (1217), il dut repasser le détroit. Devenu roi, il enleva aux Anglais plusieurs villes et participa à la grande croisade contre les albigeois.
Q346	LOUIS IX ou SAINT LOUIS, fils de Louis VIII et de Blanche de Castille, né à Poissy en 1215, roi de France de 1226 à 1270. Il régna d'abord sous la régence de sa mère, qui eut à réprimer une révolte des grands vassaux, termina la guerre des albigeois par le traité de Paris ou de Meaux (1229) et lui fit épouser Marguerite de Provence (1234). Lors de sa majorité, le comte de la Marche, aidé des Anglais, dirigea contre lui une nouvelle ligue, qu'il défit à Taillebourg et à Saintes (1242). En apprenant que la Palestine était tombée au pouvoir du sultan d'Egypte et que l'empire latin périclitait, il prit la croix, débarqua à Damiette en 1249, dut battre en retraite après la bataille de Mansourah (1250) et fut fait prisonnier. Ayant racheté sa liberté, il resta en Palestine de 1250 à 1252, et revint en France en apprenant la mort de Blanche de Castille, qui, pendant son absence, avait réprimé la révolte des pastoureaux. Il pourvut alors à l'organisation de ses Etats, fortifia considérablement l'autorité royale, rendit une ordonnance qui déterminait les devoirs des agents royaux, nomma des enquesteurs pour visiter les provinces, institua la quarantaine-le-roi pour diminuer le nombre des guerres privées, abolit le duel judiciaire, institua les cas royaux (cas ne devant être jugés que par le roi), appela à siéger dans les tribunaux les légistes pour conseiller les juges, créa une commission judiciaire qui fut l'origine du parlement, fit des efforts en vue de réaliser l'unité monétaire, assura les privilèges du clergé par la pragmatique sanction de 1269, mais se montra intolérant à l'égard des blasphémateurs et des hérétiques ; enfin, il fonda la Sainte-Chapelle, la Sorbonne et les Quinze-Vingts. En 1270, encouragé par Charles d'Anjou, son frère, il entreprit la huitième et dernière Croisade, et fit voile vers Tunis, dans l'espoir de convertir le roi de ce pays au christianisme, mais il mourut de la peste à peine débarqué devant Carthage. Saint Louis fut un monarque extrêmement pieux. La religion fut la règle même de sa conduite. Sa réputation d'intégrité et de vertu lui valut l'estime universelle, et tout le monde se le représente rendant la justice sous le chêne de Vincennes. — Joinville a écrit sa vie.
Q8384	LOUIS X le Hutin ou le Querelleur, fils de Philippe le Bel et de Jeanne de Ravanne, né à Paris en 1289, roi de France de 1314 à 1316. Il fit étrangler sa femme, Marguerite de Bourgogne, suspecte d'inconduite, envoya au supplice Enguerrand de Marigny, affranchit ses serfs pour se procurer de l'argent et entreprit contre les Flamands une expédition inutile.
Q8058	LOUIS XI, fils de Charles VII et de Marie d'Anjou, né à Bourges en 1423, roi de France de 1461 à 1483. Il avait 38 ans quand il monta sur le trône et avait épousé Marguerite d'Ecosse. Dévoré de bonne heure par la soif du pouvoir, il se laissa entraîner à dix-sept ans contre son père dans le soulèvement féodal de la Praguerie, à la suite de laquelle Charles VII le mit en possession du Dauphiné. Mais la réconciliation dura peu entre le père et le fils, qui dut se réfugier à la cour de Philippe le Bon, duc de Bourgogne (1456). A la mort de Charles VII, il signala sa prise de possession du pouvoir par diverses mesures inopportunes, dont la conséquence fut de soulever les seigneurs contre lui (ligue du Bien public) et de l'obliger à signer les traités de Conflans et de Saint-Maur ; mais Louis XI ne tarda pas à reprendre ce qu'il avait dû céder. Sur ces entrefaites, il se rendit à Péronne pour y régler ses différends avec Charles le Téméraire, qui, apprenant l'appui donné aux Liégeois révoltés par Louis XI, retint ce dernier prisonnier et lui imposa un traité humiliant (1468). Le duc de Guyenne étant mort empoisonné en 1472, Charles le Téméraire prit prétexte de cette mort tragique pour envahir la Picardie : il échoua sous les murs de Beauvais (1472). Charles avait signé contre la France un traité avec le roi d'Angleterre Edouard IV, qui vint à Calais, mais traita avec Louis XI à Picquigny (1475). La mort de Charles le Téméraire devant Nancy (1477) ayant débarrassé Louis XI de son plus redoutable adversaire, le roi de France put alors songer à abattre ses ennemis intérieurs ; dans sa lutte contre la haute noblesse, il prit son point d'appui dans les classes bourgeoises, bien qu'il ne se gênât point pour tripler les charges publiques. Charles ne laissait qu'une fille, Marie de Bourgogne. Louis XI songea un moment à la fiancer au dauphin, mais pressé de tirer parti des événements, il reprit les villes de la Somme et de la Bourgogne, qui furent définitivement réunies à la couronne, malgré les efforts de Maximilien d'Autriche, devenu l'époux de Marie, et qui avait livré aux troupes royales, à Guinegatte, une bataille indécise ; le traité d'Arras (1482) mit fin à cette lutte. Diverses mesures, notamment la citation de la poste aux chevaux, l'accroissement de la milice, l'inamovibilité des fonctions judiciaires, l'introduction de l'imprimerie à Paris signalèrent l'administration de Louis XI, qui mourut en 1483 dans son château de Plessis-lès-Tours, livré aux terreurs du remords et de la superstition. Il avait fait venir d'Italie François de Paule, dont la réputation de sainteté était arrivée jusqu'à lui. Louis XI est une des figures les plus considérables de l'histoire. Aucun prince de son temps ne connut mieux les ruses de la politique et les moyens de dominer les hommes en caressant leurs appétits. Despote cruel, gouvernant sans scrupule, il s'entoura uniquement d'hommes capables de toutes les servilités. Il força à l'obéissance tous les princes entre lesquels la France était partagée ; il réussit même à leur enlever une partie de leur pouvoir, à les déposséder, à accroître le territoire de la couronne, et à ce titre il doit figurer parmi les fondateurs de l'unité nationale. « La condamnation qu'il mérite et dont il restera chargé, c'est le blâme que la conscience humaine inflige à la mémoire de ceux qui ont cru que tous les moyens sont bons pour imposer aux faits le joug des idées. » (Aug. Thierry.)
Q107213303	Louis XI, tragédie de C. Delavigne, où l'auteur a rendu en traits saisissants le caractère de ce prince aux approches de la mort (1832).
Q58514	LOUIS XII, le Père du peuple, fils de Charles, duc d'Orléans et de Marie de Clèves, et arrière-petit-fils de Charles V, né à Blois en 1462. Révolté contre la régence d'Anne de Beaujeu (guerre folle) et fait prisonnier à Saint-Aubin-du-Cormier (1488), il fut bientôt remis en liberté, se rallia à Charles VIII, combattit glorieusement en Italie (1494-1495), monta sur le trône en 1498. Ayant fait casser son mariage avec Jeanne, fille de Louis XI, il épousa Anne de Bretagne, veuve de Charles VIII. « Le roi de France, dit-il, a oublié les injures du duc d'Orléans. » Comme petit-fils de Valentine Visconti, il revendiqua le duché de Milan et le conquit ; mais les Français furent expulsés du royaume de Naples à la suite des combats de Seminara et de Cerignoles (1503). Louis XII étant entré dans la ligue de Cambrai contre Venise remporta la victoire d'Agnadel ; abandonné par ses alliés, il put résister victorieusement à la Sainte ligue grâce à Gaston de Foix, mais à la mort de ce héros, tué à Ravenne, les Français furent chassés de l'Italie. A son tour, la France eut à soutenir l'invasion des Espagnols, des Suisses, de Henri VIII et de Maximilien, et ces derniers remportèrent la victoire de Guinegatte. L'avènement du pape Léon X, succédant au bouillant Jules II, permit à Louis XII de faire la paix. Il mourut peu de temps après (1515) ; il y avait trois mois qu'il avait épousé (Anne de Bretagne étant morte) Marie d'Angleterre, sœur de Henri VIII. Louis XII est le seul représentant de la branche des Valois-Orléans, à laquelle succédèrent avec François Ier les Valois-Angoulême.
Q29222661	Louis XII et Anne de Bretagne (tombeau de), chef-d'œuvre de Jean Juste, dans l'église de Saint-Denis, l'une des plus admirables productions de la Renaissance française.
Q737533	LOUIS XIII, fils de Henri IV et de Marie de Médicis, né à Fontainebleau au mois de septembre 1601, sous le signe de la Balance, ce qui le fit surnommer le Juste ; roi de France de 1610 à 1643. Il régna d'abord sous la régence de sa mère, qui donna toute sa confiance à l'incapable et avide Concini, lequel fut assassiné en 1617 à l'instigation du roi, et remplacé par Albert de Luynes. Jusqu'en 1624, les hommes qui se succédèrent au pouvoir ne firent rien pour la France ; mais il n'en fut plus de même, lorsque Richelieu devint premier ministre. Le cardinal poursuivit un triple but : 1° abaisser la noblesse ; 2° ruiner les protestants en tant que parti politique ; 3° abaisser la maison d'Autriche (v. Richelieu). Quant à Louis XIII, il eut le grand mérite de comprendre et de suivre les conseils du grand cardinal ; il mourut à Saint-Germain en 1643. Louis XIII avait épousé l'infante Anne d'Autriche.
Q7742	LOUIS XIV, le Grand, fils de Louis XIII et d'Anne d'Autriche, né à Saint-Germain-en-Laye en 1638, roi de France de 1643 à 1715. Il n'avait pas cinq ans lorsqu'il succéda à son père sous la régence de sa mère. Mazarin, devenu premier ministre, continua la politique extérieure de Richelieu, et si la minorité de Louis XIV fut agitée par les luttes du parlement contre la régence et par les troubles de la Fronde (v. ce mot), elle fut aussi signalée par les victoires de Rocroi, de Fribourg, de Nordlingen, de Lens, couronnées en 1648 par le traité de Westphalie. Deux ans avant sa mort, Mazarin signa avec l'Espagne la paix des Pyrénées, dont l'une des clauses était le mariage de l'infante Marie-Thérèse avec le roi de France (1659). A partir de 1661, Louis XIV annonça au conseil des ministres son intention de régner désormais par lui-même, et il soutint en effet pendant cinquante-quatre ans un effort exceptionnel de volonté et de travail. Le mot célèbre qu'on lui prête : l'Etat c'est moi ! indique assez le principe dirigeant de sa politique. Un de ses premiers actes fut de disgracier Fouquet, dont les dilapidations étaient un scandale public. Colbert, appelé à la surintendance des Finances (1661), appliqua son activité et sa puissance de travail au rétablissement de l'ordre dans l'administration des deniers publics ; il prit des mesures protectrices en faveur de l'agriculture, encouragea l'industrie, le commerce, les travaux publics, la marine, pendant qu'une commission de jurisconsultes, nommée suivant ses conseils, élaborait d'utiles ordonnances, que Louvois réorganisait l'armée et que Vauban fortifiait nos frontières. Louis XIV voulut être aussi absolu à l'extérieur que dans son propre royaume ; de là cette longue suite de guerres qui rapportèrent beaucoup de gloire à la France, mais finirent par l'épuiser : guerre contre l'Espagne au nom du droit de dévolution, terminée par le traité d'Aix-la-Chapelle (1668) ; guerre de Hollande, terminée par la paix de Nimègue (1678) ; guerre de la ligue d'Augsbourg, terminée par la paix de Ryswick (1697) ; guerre de la succession d'Espagne, terminée par les traités d'Utrecht (1713), de Rastadt et de Bade (1714). Le règne de Louis XIV prit fin en 1715. Après la mort de Marie-Thérèse (1683), Louis XIV avait épousé secrètement Madame de Maintenon, veuve du poète Scarron. Louis XIV, jusqu'à son dernier jour, se considéra comme le représentant de Dieu sur la terre, comme « participant de sa connaissance aussi bien que de son autorité », et, après avoir réduit les grands à une sorte de domesticité brillante, il en vint à s'attribuer le mérite des ministres qui le servaient. Il fut vraiment tout l'Etat, et tout ploya devant lui, noblesse, parlement, tiers état, clergé même. La centralisation à outrance, l'obéissance passive, le culte de la personne royale élevé à l'état de dogme complétèrent l'absorption de la nation, l'incarnation du peuple dans un seul homme. Son despotisme intolérant le conduisit à ne plus souffrir dans l'étendue de son royaume quelqu'un qui, en matière religieuse, pût penser autrement que lui ; il révoqua l'édit de Nantes, permit les dragonnades, et, pour extirper l'hérésie, encouragea toutes les cruautés. Ce règne, qui aurait pu être si utile au bien public grâce aux hommes de génie qui l'illustrèrent, ne fit que précipiter la ruine de la monarchie par une tension trop grande de tous les ressorts du pouvoir ; l'ambition conquérante de Louis XIV nous aliéna les sympathies de l'Europe, rendit inutiles les efforts économiques de Colbert, poussa notre diplomatie dans des voies injustes et accrut la misère du peuple, dont Vauban plaida vainement la cause auprès du roi. Aussi lorsque mourut celui qui était monté sur le trône entouré d'une auréole de gloire et de l'idolâtrie nationale, on vit la foule accompagner de ses malédictions la dépouille mortelle de Louis le Grand. On sait que sous Louis XIV les lettres et les arts furent portés à un haut degré de perfection par une pléiade brillante de prosateurs, de poètes et d'artistes : Corneille, Racine, Molière dans le théâtre ; La Fontaine et Boileau dans la poésie ; Bossuet, Fénelon, Fléchier dans l'éloquence ; La Bruyère et La Rochefoucauld, dans la critique morale ; Pascal dans la philosophie ; Saint-Simon et Retz dans l'histoire ; Poussin, Le Lorrain, Lebrun, Perrault, Mansard, Girardon, Puget dans les arts, furent les principaux représentants du siècle de Louis XIV.
Q3227222	Louis XIV (Siècle de), par Voltaire (1751). C'est, avec Charles XII, le principal titre de Voltaire comme historien. La narration est un modèle de concision et d'élégance, et l'ouvrage est un tableau achevé, parfois un peu trop complaisant, du grand siècle.
Q3399440	Louis XIV (portrait de), tableau d'Hyacinthe Rigaud, au Louvre (1701), un des meilleurs du peintre.
Q3497623	Louis XIV (statue de), statue équestre en bronze par Bosio, érigée sous la Restauration, place des Victoires, à Paris.
Q784173	LOUIS, grand dauphin de France, fils de Louis XIV et de Marie-Thérèse (1661-1711). Il eut pour fils Louis, duc de Bourgogne ; Philippe d'Anjou, depuis roi d'Espagne, et Charles, duc de Berry.
Q7738	LOUIS XV, le Bien-Aimé, troisième fils de Louis, duc de Bourgogne et de Marie-Adélaïde de Savoie, et arrière-petit-fils de Louis XIV, né à Versailles en 1710, roi de France de 1715 à 1774. Il régna d'abord sous la régence de Philippe d'Orléans, personnage intelligent, mais corrompu, qui subit la désastreuse influence du cardinal Dubois. La régence fut signalée par la banqueroute de Law et la guerre contre l'Espagne, suscitée par le renvoi de l'infante destinée en mariage à Louis XV, à qui l'on fit épouser Marie Leczinska. A la mort du régent Philippe (1723), le duc de Bourbon devint ministre ; mais son impopularité l'éloigna bientôt des affaires (1726). Sous le ministère de l'honnête, mais timide cardinal Fleury (1726-1743), eurent lieu la guerre de la succession de Pologne (1733-1735), que termina le traité de Vienne (1738), et la guerre de la succession d'Autriche, à la quelle mit fin la paix d'Aix-la-Chapelle (1748). A partir de ce moment, Louis XV glissa sur la pente qui devait le conduire au déshonneur et se laissa mener par ses favorites. La guerre de Sept ans (1756-1763) aboutit à la perte de nos colonies, bien que Choiseul eût réuni en 1761 par le pacte de famille, les quatre branches régnantes de la maison de Bourbon. A ce moment, le trône tombe dans la boue ; les favorites règnent, Louis XV frappe les jésuites et les parlements, les deux soutiens les plus solides de la monarchie, et Choiseul fait place (1770) au triumvirat Maupeou, Terray et d'Aiguillon ; c'est l'époque du pacte de famine et de la diplomatie du duc d'Aiguillon ; c'est le temps où Louis XV dit : « Cela durera bien autant que moi. » Lorsque le Bien-Aimé mourut, en 1774, la joie de la foule déborda. Outrés de la corruption qui s'étalait jusque sur les marches du trône, les philosophes du xviiie siècle réagirent par leurs écrits contre les abus : Voltaire, Montesquieu, Rousseau, les encyclopédistes et les physiocrates créèrent un puissant courant d'opinion, pendant que Franklin, Galvani, Lavoisier, Linné, Buffon, Jussieu, dirigeaient la science dans des voies nouvelles.
Q1127464	LOUIS, dauphin de France, fils de Louis XV et de Marie Leczinska, père de Louis XVI, de Louis XVIII et de Charles X (1729-1765).
Q7732	LOUIS XVI, fils du dauphin Louis, fils de Louis XV, et de la princesse Marie-Josèphe de Saxe, né à Versailles en 1754, roi de France en 1774, décapité en 1793. Marié déjà à Marie-Antoinette d'Autriche, jouissant à juste titre d'une grande réputation de vertu, il fut salué à son avènement par des cris d'enthousiasme, qui étaient en même temps des cris de protestation contre les turpitudes du règne précédent. Il appela au pouvoir Turgot et Malesherbes, dont les conceptions économiques et politiques soulevèrent une telle opposition que le roi dut se séparer de ces ministres réformateurs. Necker ne réussit pas davantage : sa disgrâce suivit de près la publication du Compte rendu de l'état des finances, alors commença le règne des ministres courtisans et l'influence de la reine devint toute-puissante, mais il se produisit un mouvement d'opinion qui obligea Louis XVI à rappeler Necker. Celui-ci, devant la résistance des notables et le mauvais état du Trésor public, décida le roi à convoquer les états généraux, qui se réunirent à Versailles en 1789. Louis XVI, plein de bonnes intentions, mais faible et subissant l'influence des courtisans et de la reine, perdit sa popularité par ses hésitations, par l'appui secret qu'il donna aux émigrés, par sa tentative de fuite, enfin par ses négociations impardonnables avec l'étranger. Suspendu de ses fonctions après le 10-Août, enfermé au Temple et jugé par la Convention, il fut condamné à mort comme « coupable de conspiration contre la liberté de la nation et d'attentat contre la sûreté générale de l'Etat ». L'exécution eut lieu le 21 janvier 1793.
Q49765	LOUIS XVII, second fils de Louis XVI et de Marie-Antoinette, né à Versailles en 1785. Enfermé au Temple, il fut, après l'exécution de son père, proclamé roi de France par les princes émigrés. Il mourut dans sa prison en 1795. Certains auteurs prétendent qu'on le fit évader et qu'on lui substitua un enfant malade. A la faveur de cette opinion, certains intrigants, dont les plus connus sont Naundorf et Mathurin Bruneau, cherchèrent, depuis la chute de Napoléon Ier, à se faire passer pour le dauphin. Mais aucune preuve sérieuse n'est venue ébranler la conviction générale que le dauphin est réellement mort dans sa prison.
